date_debut;date_fin;intitule;salle;professeur;groupe
hello;hello;Controle Introduction Generale au Droit;Amphitheatre;LUCIEN VAN IMPE;UBCAA1CM;
hello;hello;CM R. Outils statistiques de pilotage d'un process;A101;STEPHEN KUNG;B2QLPFICM;
hello;hello;TP R. Outils\, methodes et communication pour la qualite;A105;STEPHEN KUNG;B1QLIOTP01;
hello;hello;TD S. Mettre en oeuvre une organisation comptable et fiscale;A302;NELSON OLIVEIRA;B1GEATD02;
hello;hello;MAT Traitement de l'information;None;GIANNI MOSCON;MIF;
hello;hello;CM R. Droit fiscal 1;B500;BUT2 CJ PF;B2CJEACM;
hello;hello;TP S. Portfolio 1;None;Inconnu;B2CJPFTP02;
