date_debut;date_fin;intitule;salle;professeur;groupe
2022-09-21 08:30:00;2022-09-21 10:00:00;CM R. Droit pénal;B500;ALBERTO BETTIOL;B2CJEACM;
2022-10-05 07:15:00;2022-10-05 08:30:00;TP R. Probabilités;A304;PETER SAGAN;B2INFOTPA1;
2022-09-20 11:00:00;2022-09-20 12:15:00;TP R. Mathématiques discrètes;B301 grande salle;PETER SAGAN;B1INFOTP04;
2022-11-15 07:00:00;2022-11-15 08:00:00;CM R. Comptabilité 1;Amphithéâtre;FEDERICO BAHAMONTES;B1GEACM;
2022-10-03 08:45:00;2022-10-03 10:15:00;PROJET Situer une organisation dans son environnement;Null;Null;B1GEATP01;
2022-12-01 13:15:00;2022-12-01 14:45:00;MAT Finance d'entreprise;B405;HENRI PELISSIER;DU;
2023-01-03 07:00:00;2023-01-03 08:15:00;TP R. Développement web;A300;JAKOB FUGLSANG;B2INFOTPA1;
2022-11-16 12:30:00;2022-11-16 14:00:00;TD R. Ressources humaines 1;B402;OSCAR PEREIRO;B1GEATD03;
2023-01-11 07:00:00;2023-01-11 09:00:00;TP R. Outils\, méthodes et communication pour la qualité;A105;STEPHEN KUNG;B1QLIOTP02;
2022-10-13 07:45:00;2022-10-13 09:15:00;MAT R. Outils numériques de communication 1;A202;THIBAUT PINOT;B1GEATD02;
2022-10-10 13:00:00;2022-10-10 14:15:00;TP R. Approvisionnements et exécution de planning;A102;ROBERT STANNARD;B1QLIOTP01;
2022-10-04 15:45:00;2022-10-04 16:45:00;PROJET Rédaction professionnelle au sein d’une organisation;Null;Null;B1CJTP01;
