date_debut;date_fin;intitule;salle;professeur;groupe
2022-12-12 13:15:00;2022-12-12 14:30:00;TP R. Introduction à la gestion des organisations;A305;LEON SCIEUR;B1INFOTP03;
2022-10-11 06:00:00;2022-10-11 07:30:00;CM R. Droit constitutionnel 1;B500;CALEB EWAN;B1CJCM;
2022-11-25 14:45:00;2022-11-25 16:15:00;TD R. Psychologie sociale 1;B505;MARK PADUN;B1GEATD01;
2022-11-18 13:30:00;2022-11-18 15:00:00;PROJET Mettre en œuvre une organisation comptable et fiscale;Null;Null;B1GEATP05;
2022-10-12 12:15:00;2022-10-12 13:30:00;PROJET Installation d'un poste pour le développement;A500;Null;B1INFOTP03;
2023-01-05 07:30:00;2023-01-05 09:00:00;MAT Anglais;B501 Labo 1;JONAS VINGEGAARD;PILAL;
2022-09-12 12:45:00;2022-09-12 14:00:00;TP R. Architecture des réseaux;A305;ESTEBAN CHAVES;B2INFOTPA2;
2022-10-10 15:45:00;2022-10-10 16:45:00;PROJET Fonctions et activités juridiques\, comptables\, financ;Null;Null;B1CJTP04;
2022-12-01 11:00:00;2022-12-01 12:00:00;PROJET Formulation d'un conseil juridiques\, comptable\, finan;Null;Null;B1CJTP01;
2022-12-10 09:00:00;2022-12-10 10:00:00;PROJET Sécurisation des activités d’une organisation;Null;Null;B1CJTP02;
2022-10-19 07:30:00;2022-10-19 08:45:00;TD R. Bases des mathématiques et des statistiques;A100;ALEJANDRO VALVERDE;B1QLIOTD;
2022-12-06 14:45:00;2022-12-06 16:45:00;OI TP S. Projet Supply Chain en tant que technicien 1;A105;DYLAN TEUNS;B2QLPFITD;
2022-10-28 08:15:00;2022-10-28 09:45:00;TP R. Projet personnel et professionnel 1;A200;JULIAN ALAPHILIPPE;B1ICTP01;
2022-10-18 11:30:00;2022-10-18 13:00:00;MAT Calcul de coûts;A103;LEON SCIEUR;PILAL;
2022-10-07 08:15:00;2022-10-07 10:15:00;TP R. Algorithmique et programmation avancées;A104;ALEJANDRO VALVERDE;B2QLPALTP;
2023-01-10 15:45:00;2023-01-10 16:45:00;PROJET Portfolio 1;Null;Null;B1ICTP02;
2022-09-30 10:45:00;2022-09-30 12:15:00;TD R. Outils et pilotage de l’organisation : Financement;B505;EGAN BERNAL;B2GEMATD;
2022-11-08 08:15:00;2022-11-08 09:30:00;TD S. Développement d'une application;A205;ESTEBAN CHAVES;B2INFOTDA1;
2022-12-06 16:00:00;2022-12-06 17:30:00;TP S. Mettre en œuvre une organisation comptable et fiscale;A203;GINO BARTALI;B1GEATP02;
2023-02-01 14:45:00;2023-02-01 16:00:00;TD R. Introduction à la gestion des systèmes d’information;A303;LEON SCIEUR;B1INFOTD01;
2023-01-27 07:30:00;2023-01-27 09:00:00;TD R. Contrats spéciaux;B505;ROMAIN BARDET;B2CJEATD;
2022-09-26 09:00:00;2022-09-26 11:00:00;PROJET Créer un objet ou un service innovant;Null;Null;B2ICTP02;
2022-10-05 11:30:00;2022-10-05 12:30:00;CM R. Probabilités;B301 grande salle;PETER SAGAN;B2INFOCMA, B2INFOCMD;
2023-01-09 14:45:00;2023-01-09 16:15:00;MAT Projet personnel et professionnel;A400 Learning lab;BERNARD HINAULT;MIF;
2022-11-16 14:45:00;2022-11-16 16:00:00;TP R. Développement d'interfaces web;A304;JAKOB FUGLSANG;B1INFOTP01;
2022-11-10 07:00:00;2022-11-10 08:00:00;PROJET Fonctions et activités juridiques\, comptables\, financ;Null;Null;B1CJTP01;
2022-09-20 15:00:00;2022-09-20 16:15:00;TD R. Initiation au développement;A304;WOUT VAN AERT;B1INFOTD02;
2023-01-17 16:00:00;2023-01-17 17:15:00;CM R. Amélioration de la performance;A101;NACER BOUHANNI;B2QLPFICM;
2022-10-15 08:00:00;2022-10-15 09:00:00;PROJET Fonctions et activités juridiques\, comptables\, financ;Null;Null;B1CJTP03;
2022-09-27 08:45:00;2022-09-27 10:15:00;MAT R. Projet Personnel et Professionnel 1;A200;THIBAUT PINOT;B1GEATP02;
2022-09-20 11:30:00;2022-09-20 13:30:00;MAT Français;A400 Learning lab;BERNARD HINAULT;MIF;
2023-01-27 07:00:00;2023-01-27 08:00:00;CM R. Outils numériques pour les statistiques descriptives;B301 grande salle;PETER SAGAN;B1INFOCM;
2022-11-22 14:45:00;2022-11-22 16:15:00;TP R. Comptabilité 1;B404;GREG LEMOND;B1GEATP02;
2022-11-07 17:00:00;2022-11-07 18:00:00;PROJET Fonctions et activités juridiques\, comptables\, financ;Null;Null;B1CJTP02;
2022-09-28 06:00:00;2022-09-28 07:30:00;CM R. Environnement juridique 1;Amphithéâtre;RUDY MOLARD;B1GEACM;
2022-11-30 09:45:00;2022-11-30 11:00:00;TP R. Communication professionnelle;A303;BERNARD HINAULT;B2INFOTPA3, B2INFOTPD;
2022-10-18 11:30:00;2022-10-18 12:45:00;TP R. Expression Communication 1;A101;BERNARD HINAULT;B2QLPFITD;
2022-10-03 13:45:00;2022-10-03 15:15:00;TP R. Expression/Communication et culture générale 1;A203;OSCAR PEREIRO;B1GEATP03;
2023-01-11 08:45:00;2023-01-11 09:45:00;TD R. Expression communication 2;B507;Null;B2CJPFTD;
2022-12-02 09:15:00;2022-12-02 11:15:00;TP R. Expression communication 1;B401;OSCAR PEREIRO;B2CJEATP01;
2022-10-11 09:00:00;2022-10-11 10:30:00;TP R. Expression/Communication et culture générale 1;A200;THIBAUT PINOT;B1GEATP02;
2022-10-12 13:00:00;2022-10-12 14:15:00;TP R. Approvisionnements et exécution de planning;A102;ROBERT STANNARD;B1QLIOTP02;
2022-10-24 11:30:00;2022-10-24 13:30:00;PROJET Proposer une recommandation sur la stratégie de commu;Null;Null;B2ICTP02;
2022-12-09 08:45:00;2022-12-09 10:15:00;PROJET Contribuer au développement ou à la création d'une or;Null;Null;B2GEMATP02;
2022-12-16 09:00:00;2022-12-16 11:00:00;TP S. Concevoir un dispositif de communication hybridant;A400 Learning lab\,C200 Salle Infocom;MARK CAVENDISH;B2ICTP02;
2023-01-17 09:15:00;2023-01-17 11:15:00;TD R. Conduite d'un projet d'amélioration;A104;NACER BOUHANNI;B2QLPALTD;
2022-12-06 16:30:00;2022-12-06 17:30:00;PROJET Contribuer au développement ou à la création d'une or;Null;Null;B2GEMAALT;
2022-10-28 06:30:00;2022-10-28 08:30:00;MAT R. Structure et fonctionnement des organisations et RSE;B506;REIN TAARAMAE;B1CJTD01;
2023-02-03 12:15:00;2023-02-03 14:15:00;MAT R. Expression écrite et orale 2;A400 Learning lab;GUY NIV;B2ICTP02;
2022-12-02 07:00:00;2022-12-02 09:00:00;TP S. Portfolio 1;A307;BERNARD HINAULT;B2QLPFITD;
2022-10-27 06:00:00;2022-10-27 07:30:00;TP S. Situer une organisation dans son environnement;B302 grande salle;PIERRE ROLLAND;B1GEATP03;
2022-10-18 14:00:00;2022-10-18 15:30:00;Management d’activités : Business Model;C302 (salle en U);SIMON GESCHKE;B2GEMAALT;
2022-12-12 09:00:00;2022-12-12 11:00:00;TP S. Concevoir un dispositif de communication hybridant;A400 Learning lab\,C200 Salle Infocom;MARK CAVENDISH;B2ICTP02;
2023-01-27 14:45:00;2023-01-27 16:15:00;MAT Stratégie de communication événementielle;C300;RENE POTTIER;CCRC;
2022-10-27 07:45:00;2022-10-27 09:15:00;PROJET Situer une organisation dans son environnement;Null;Null;B1GEATP03;
2022-09-16 11:30:00;2022-09-16 13:30:00;MAT Droit des sociétés et des groupements d’affaires;B400;SONNY COLBRELLI;DU, MLGAB3TD01;
2022-10-11 14:00:00;2022-10-11 15:15:00;TP R. Analyse;A300;CHRISTOPHE LAPORTE;B2INFOTPA2;
2022-10-14 06:00:00;2022-10-14 08:00:00;CM R. Gestion de l’entreprise;A104;LEON SCIEUR;B2QLPALCM;
2022-11-21 10:00:00;2022-11-21 11:00:00;TD R. Expression Communication 1;A100;JULIAN ALAPHILIPPE;B1QLIOTD;
2022-11-17 08:15:00;2022-11-17 09:30:00;PROJET Implémentation d’un besoin client;A304;Null;B1INFOTP02;
2023-01-16 09:15:00;2023-01-16 10:45:00;MAT Contrôle de gestion;B404;Null;DU;
2022-11-09 12:30:00;2022-11-09 14:00:00;UE02 Analyse de la performance (LCCE08) - CM;B400;MATTHIEU LADAGNOUS;MLGAB3CM01, DU;
2022-10-05 11:30:00;2022-10-05 12:45:00;TD R. Gestion de l’entreprise;A101;LEON SCIEUR;B2QLPFITD;
2022-12-02 07:00:00;2022-12-02 08:15:00;TD S. Développement d'une application;A300;PETER SAGAN;B2INFOTDA2, B2INFOTDD;
2022-11-10 09:15:00;2022-11-10 11:15:00;TP R. Connaissance technologique et socio-économique des ent;A100;STEPHEN KUNG;B1QLIOTP02;
2022-11-29 14:15:00;2022-11-29 16:15:00;PROJET Proposer une recommandation sur la stratégie de commu;Null;Null;B2ICTP01;
2022-10-14 06:00:00;2022-10-14 07:30:00;PROJET Portfolio 1;Null;Null;B2CJPFTP01;
2022-11-09 10:00:00;2022-11-09 11:30:00;TD R. Expression et communication 1;Null;LOUIS TROUSSELIER;B1CJTD02;
2022-10-18 15:00:00;2022-10-18 16:15:00;PROJET Création d'une base de données;A300;Null;B1INFOTP01;
2022-09-20 09:00:00;2022-09-20 10:15:00;TD R. Organisation d’un projet;A100;ARNAUD DEMARE;B1QLIOTD;
2023-01-05 07:30:00;2023-01-05 09:30:00;MAT Management situationnel;A400 Learning lab;JULIAN ALAPHILIPPE;CCRCFIIC;
2022-10-20 06:00:00;2022-10-20 07:30:00;PROJET Mettre en œuvre une organisation comptable et fiscale;Null;Null;B1GEATP02;
2022-11-12 10:00:00;2022-11-12 11:00:00;PROJET Fonctions et activités juridiques\, comptables\, financ;Null;Null;B1CJTP01;
2022-12-13 16:00:00;2022-12-13 18:00:00;PROJET Contribution aux activités de pilotage et de conseil;Null;Null;B2CJEATP01;
2022-09-15 11:00:00;2022-09-15 13:00:00;CM S. Rédaction professionnelle au sein d’une organisation;B500;LUCIEN VAN IMPE;B1CJCM;
2022-09-29 07:45:00;2022-09-29 09:15:00;CM R. Introduction générale au droit;B500;LUCIEN VAN IMPE;B1CJCM;
2022-09-27 06:30:00;2022-09-27 08:00:00;MAT Calcul de coûts;A103;LEON SCIEUR;PILAL;
2022-09-27 11:30:00;2022-09-27 12:45:00;TP R. Outils numériques;A307;ALEJANDRO VALVERDE;B1QLIOTP01;
2022-11-18 07:00:00;2022-11-18 09:00:00;TP R. Management d’activités : Management opérationnel;A204;NACER BOUHANNI;B2GEMATP02;
2022-10-11 09:00:00;2022-10-11 10:15:00;TD R. Algorithmique et programmation avancées;A102;ALEJANDRO VALVERDE;B2QLPFITD;
2023-01-24 09:15:00;2023-01-24 11:15:00;MAT Anglais;B300 Learning lab;ARNAUD DEMARE;MIF;
2022-09-09 11:15:00;2022-09-09 13:15:00;MAT Design graphique;A202;JAN ULLRICH;CCRCFIEG;
2022-09-23 12:15:00;2022-09-23 13:30:00;TD R. Outils mathématiques fondamentaux;A300;PETER SAGAN;B1INFOTD01;
2023-01-30 15:00:00;2023-01-30 16:15:00;TP R. Complément Web;A300;JAKOB FUGLSANG;B2INFOTPA1;
2022-11-07 10:00:00;2022-11-07 11:15:00;TD R. Introduction aux Systèmes de Management de la Qualité;A100;TADEJ POGACAR;B1QLIOTD;
2023-01-31 09:45:00;2023-01-31 10:45:00;TD S. Construire une stratégie de communication numérique;C303;ENRIC MAS;B2ICTD;
2022-12-08 12:30:00;2022-12-08 16:30:00;PROJET Immersion - Organisation;Null;Null;B1QLIOTP01;
2022-10-01 06:00:00;2022-10-01 08:00:00;PROJET Assistance à la prise de décision d’un client ou d'un;Null;Null;B2CJPFTP02;
2022-10-03 13:45:00;2022-10-03 15:15:00;TD S. Rédaction professionnelle au sein d’une organisation;B500\,B507\,B405;LUCIEN VAN IMPE;B1CJTD01;
2023-01-23 08:15:00;2023-01-23 09:30:00;TP R. Exploitation d'une base de données;A205;DAVID GAUDU;B1INFOTP03;
2023-01-03 07:00:00;2023-01-03 08:30:00;TD R. Comptabilité 1;B404;GREG LEMOND;B1GEATD01;
2022-12-14 10:30:00;2022-12-14 12:00:00;PROJET Mettre en œuvre une organisation comptable et fiscale;Null;Null;B1GEATP05;
2022-09-22 11:30:00;2022-09-22 12:45:00;TD R. Introduction à l'architecture des ordinateurs;A301;SAM BENNET;B1INFOTD02;
2023-01-06 11:45:00;2023-01-06 13:15:00;TP R. Outils mathématiques de gestion 1;B400;HUGO KOBLET;B1GEATP03, B1GEATP04;
2022-09-29 12:00:00;2022-09-29 13:00:00;PROJET Rédaction professionnelle au sein d’une organisation;Null;Null;B1CJTP03;
2022-11-10 07:45:00;2022-11-10 09:00:00;TP R. Projet Personnel et Professionnel 1;A102;JONAS VINGEGAARD;B1QLIOTP02;
2022-11-22 12:30:00;2022-11-22 14:30:00;OI TP S. Projet Supply Chain en tant que technicien 1;A105;DYLAN TEUNS;B2QLPFITD;
2023-01-04 07:00:00;2023-01-04 08:15:00;TP S. Développement d'une application;A300;PETER SAGAN;B2INFOTPA1;
2022-11-15 15:15:00;2022-11-15 16:45:00;MAT Calculs commerciaux\; stats\, analyse fi\, budget S5;C300;FRED WRIGHT;CCRCFI01;
2022-09-15 11:30:00;2022-09-15 13:00:00;TD R. Comptabilité 1 : Techniques de base de comptabilité ap;B505;FEDERICO BAHAMONTES;B2GC2FTD;
2022-10-05 07:30:00;2022-10-05 09:00:00;TP R. Ecrit et oral spécifiques;C303;VINCENZO NIBALI;B1ICTP02;
2023-01-05 09:45:00;2023-01-05 11:00:00;TP S. Implémentation d’un besoin client;A304;ANDY SCHLECK;B1INFOTP03;
2022-11-09 09:15:00;2022-11-09 10:45:00;UE10  Anglais;B504\,B501 Labo 1;ROGER KLUGE;BANQUE;
2023-01-12 10:30:00;2023-01-12 12:00:00;MAT R. Procédure pénale;Null;Null;B2CJEACM;
2023-01-20 09:15:00;2023-01-20 11:15:00;TP R. Communication numérique\, webdesign et data management;A202;JAN ULLRICH;B2ICTP02;
2023-01-10 07:00:00;2023-01-10 09:00:00;TD R. Activités d’un site logistique;A104;ROBERT STANNARD;B2QLPALTD;
2022-10-11 08:30:00;2022-10-11 09:45:00;TP R. Introduction aux bases de données et SQL;A304;ALBERTO CONTADOR;B1INFOTP01;
2022-11-07 12:30:00;2022-11-07 14:30:00;TP R. Design graphique et audiovisuel;A400 Learning lab\,C200 Salle Infocom;MARK CAVENDISH;B2ICTP01;
2022-10-08 07:00:00;2022-10-08 08:00:00;PROJET Rédaction professionnelle au sein d’une organisation;Null;Null;B1CJTP02;
2023-01-25 12:00:00;2023-01-25 13:15:00;TD R. Introduction à la gestion des systèmes d’information;A301;LEON SCIEUR;B1INFOTD02;
2022-09-22 12:30:00;2022-09-22 14:30:00;MAT Médiaplanning;A202;ALEXANDER KRISTOFF;CCRCFIEG;
2022-11-24 09:15:00;2022-11-24 10:45:00;MAT Outils de traçabilité et veille technologie;A104;CLEMENT RUSSO;PILAL;
2022-12-02 08:45:00;2022-12-02 09:45:00;CM R. Expression/communication et culture générale 1;Amphithéâtre;THIBAUT PINOT;B2GC2FCM, B2GEMACM;
2022-11-22 12:30:00;2022-11-22 13:45:00;TP R. Anglais;A400 Learning lab;ROGER KLUGE;B1QLIOTP02;
2023-01-04 07:00:00;2023-01-04 08:30:00;UE14 Gestion et financement de l’activité professionnelle;B504;ADRIEN PETIT;BANQUE;
2023-01-23 07:00:00;2023-01-23 08:15:00;TP R. Introduction à la gestion des systèmes d’information;A300;ANDY SCHLECK;B1INFOTP01;
2022-11-16 08:45:00;2022-11-16 10:15:00;TP R. Contrôle de gestion;B505;GREG LEMOND;B2GEMATP01;
2022-12-09 07:00:00;2022-12-09 08:00:00;MAT Sécurité informatique;B300 Learning lab;FAUSTO COPI;MIF;
2022-10-25 08:30:00;2022-10-25 10:30:00;TP R. Aide aux apprentissages 1;B405;PHILIPPE THYS;B1GEATP04;
2022-09-09 08:30:00;2022-09-09 09:45:00;TP R. Introduction aux bases de données et SQL;A300;DAVID GAUDU;B1INFOTP01;
2023-01-10 15:15:00;2023-01-10 16:30:00;TD S. Développement d'une application;A300;BERNARD HINAULT;B2INFOTDA1;
2023-01-16 09:00:00;2023-01-16 10:30:00;Contrôle Comptabilité approfondie;Amphithéâtre;FEDERICO BAHAMONTES;B2GC2FTD;
2022-11-15 13:00:00;2022-11-15 15:00:00;MAT Calculs commerciaux\; stats\, analyse fi\, budget S5;C300;FRED WRIGHT;CCRCFI01;
2023-01-23 14:45:00;2023-01-23 16:15:00;TP R. Finance : Politique de financement;B404;OCTAVE LAPIZE;B2GC2FTP01;
2023-02-02 08:15:00;2023-02-02 09:30:00;MAT R. Méthodes d’optimisation;A300;PETER SAGAN;B2INFOTPA3, B2INFOTPD;
2023-01-03 14:45:00;2023-01-03 16:45:00;MAT S. Résolution de problèmes;A100;CLEMENT RUSSO;B1QLIOTP01;
2022-11-09 13:15:00;2022-11-09 14:30:00;TP R. Bases de la communication;A304;OLIVER NAESEN;B1INFOTP04;
2023-01-12 09:00:00;2023-01-12 10:00:00;Contrôle Outils numériques de gestion;Amphithéâtre;THIBAUT PINOT;B1GEATD01, B1GEATD02, B1GEATD03;
2022-10-13 06:00:00;2022-10-13 07:15:00;TP R. Introduction aux systèmes d'exploitation et à leur fon;A205;DAVID GAUDU;B1INFOTP02;
2023-01-17 07:00:00;2023-01-17 09:00:00;MAT Traitement de l’information;Null;GIANNI MOSCON;MIF;
2022-11-21 12:30:00;2022-11-21 14:30:00;PROJET Etudier et comparer les stratégies de communication d;Null;Null;B1ICTP02;
2022-10-24 15:00:00;2022-10-24 16:30:00;PROJET Portfolio 1;Null;Null;B2CJPFTP02;
2022-11-16 12:30:00;2022-11-16 14:30:00;MAT R. Outils numériques et de communication 1;A200;MARCO PANTANI;B1CJTP02;
2022-09-19 11:30:00;2022-09-19 12:45:00;TD R. Mathématiques;A101;ALEJANDRO VALVERDE;B2QLPFITD;
2023-01-11 16:00:00;2023-01-11 17:15:00;TP S. Recueil de besoins;B300 Learning lab\,A300;JAKOB FUGLSANG;B1INFOTP02;
2023-01-30 09:30:00;2023-01-30 10:30:00;MAT Conférences - Ateliers professionnels;B504;LOUISON BOBET;CCRCFI01;
2022-10-24 11:30:00;2022-10-24 13:30:00;TD R. Gestion de projet;A200;LUCIEN AIMAR;B1ICTD;
2022-12-15 09:15:00;2022-12-15 11:15:00;TD R. Anglais des affaires;A104;NICOLAS FRANTZ;B2QLPALTD;
2022-12-07 14:45:00;2022-12-07 16:45:00;MAT R. Outils numériques et de communication 1;A201;MARCO PANTANI;B1CJTP04;
2022-09-08 12:30:00;2022-09-08 14:30:00;MAT Médiaplanning;A202;ALEXANDER KRISTOFF;CCRCFIEG;
2022-10-24 11:00:00;2022-10-24 12:15:00;TP R. Anglais 1;B502 Labo 2;PHILIPPE THYS;B1INFOTP03;
2022-12-05 09:15:00;2022-12-05 11:15:00;MAT Programmation système et réseau;A201;DAVID GAUDU;MMS;
2022-10-07 13:30:00;2022-10-07 15:30:00;TP S. Rédaction professionnelle au sein d’une organisation;Null;Null;B1CJTP02;
2022-12-02 07:30:00;2022-12-02 08:30:00;PROJET Formulation d'un conseil juridiques\, comptable\, finan;Null;Null;B1CJTP03;
2022-10-07 13:45:00;2022-10-07 15:15:00;PROJET Construire une posture professionnelle;Null;Null;B1GEATP06;
2022-11-10 12:00:00;2022-11-10 16:30:00;MAT Professionnalisation;B300 Learning lab;JAKOB FUGLSANG, BERNARD HINAULT;MMS;
2022-11-17 08:15:00;2022-11-17 09:45:00;TD R. Anglais appliqué aux affaires 1;B502 Labo 2;ROGER KLUGE;B1GEATD03;
2022-12-02 09:15:00;2022-12-02 11:15:00;TP R. Traitement des données;A307;MICHAEL MATTHEWS;B1ICTP02;
2022-10-07 07:45:00;2022-10-07 09:15:00;PROJET Construire une posture professionnelle;Null;Null;B1GEATP02;
2022-12-05 12:00:00;2022-12-05 13:15:00;TP R. Initiation au développement;A300;ANDY SCHLECK;B1INFOTP04;
2022-11-09 13:15:00;2022-11-09 14:30:00;PROJET Installation d'un poste pour le développement;A500;Null;B1INFOTP01;
2022-12-01 12:30:00;2022-12-01 14:00:00;PROJET Projet Supply Chain en tant que technicien 1;A101;Null;B2QLPFITD;
2022-10-01 06:00:00;2022-10-01 07:00:00;PROJET Rédaction professionnelle au sein d’une organisation;Null;Null;B1CJTP02;
2022-10-27 07:45:00;2022-10-27 09:15:00;MAT Contrôle de gestion;B404;VALENTIN MADOUAS;DU;
2022-10-03 11:45:00;2022-10-03 13:15:00;UE01 Evaluation et rattachement à l'exercice (LCCE07) - CM;B400;FEDERICO BAHAMONTES;MLGAB3CM01, DU;
2022-09-09 08:00:00;2022-09-09 09:30:00;TD R. Anglais 1;A202;NICOLAS FRANTZ;B1ICTD;
2022-12-08 10:30:00;2022-12-08 11:30:00;TP S. Conseil financier et/ou patrimonial;B506;SONNY COLBRELLI;B2CJPFTP01;
2023-02-02 08:45:00;2023-02-02 10:15:00;MAT R. Droit fiscal 2;Amphithéâtre;Null;B2CJEACM;
2022-11-16 07:00:00;2022-11-16 08:30:00;TP S. De la recherche de l’idée à la création d'activité à l;B404;OCTAVE LAPIZE;B2GEMATP01;
2022-11-25 09:45:00;2022-11-25 11:15:00;PROJET Réaliser une synthèse documentaire à propos d'une org;A307;Null;B1ICTP02;
2022-10-26 11:30:00;2022-10-26 13:30:00;MAT R. Outils numériques et de communication 1;A203;MARCO PANTANI;B1CJTP02;
2022-12-06 16:15:00;2022-12-06 17:30:00;PROJET Développement d'une application;A205;Null;B2INFOTPA2;
2023-02-01 09:00:00;2023-02-01 11:00:00;MAT Ergonomie\, conception et programmation des IHM;A201;CHRISTOPHE LAPORTE;MMS;
2022-09-21 11:30:00;2022-09-21 13:00:00;TP R. Expression Communication 1;A307;JULIAN ALAPHILIPPE;B1QLIOTP02;
2022-11-10 07:00:00;2022-11-10 09:00:00;PROJET Conseil financier et/ou patrimonial;Null;Null;B2CJPFTP02;
2022-11-09 14:15:00;2022-11-09 15:45:00;MAT Droit fiscal;B404;GINO BARTALI;DU;
2022-11-10 07:00:00;2022-11-10 08:00:00;PROJET Fonctions et activités juridiques\, comptables\, financ;Null;Null;B1CJTP02;
2022-12-06 12:15:00;2022-12-06 13:45:00;TP R. Langue vivante 2 – S1;C303;JASPER PHILIPSEN;B1ICTP01;
2022-11-26 15:00:00;2022-11-26 16:00:00;PROJET Formulation d'un conseil juridiques\, comptable\, finan;Null;Null;B1CJTP04;
2022-09-30 11:00:00;2022-09-30 12:00:00;CM R. Introduction à l'architecture des ordinateurs;B301 grande salle;SAM BENNET;B1INFOCM;
2022-12-15 12:30:00;2022-12-15 14:00:00;PROJET Mettre en œuvre une organisation comptable et fiscale;Null;Null;B1GEATP03;
2022-10-13 07:45:00;2022-10-13 09:15:00;TD R. Anglais appliqué aux affaires 1;B501 Labo 1;PHILIPPE THYS;B1GEATD01;
2023-01-25 14:00:00;2023-01-25 15:15:00;TD R. Prévision et planification de la distribution;A103;ROBERT STANNARD;B2QLPFITD;
2022-09-29 06:30:00;2022-09-29 08:00:00;TP R. Anglais 1;B502 Labo 2;NICOLAS FRANTZ;B1ICTP02;
2022-11-17 07:00:00;2022-11-17 09:00:00;MAT Suivi des coûts;B300 Learning lab;LEON SCIEUR;MIF;
2022-10-29 07:00:00;2022-10-29 08:00:00;PROJET Fonctions et activités juridiques\, comptables\, financ;Null;Null;B1CJTP02;
2022-10-29 09:00:00;2022-10-29 10:00:00;PROJET Fonctions et activités juridiques\, comptables\, financ;Null;Null;B1CJTP02;
2022-12-08 13:00:00;2022-12-08 14:00:00;PROJET Sécurisation des activités d’une organisation;Null;Null;B1CJTP04;
2022-10-24 12:15:00;2022-10-24 13:30:00;TP R. Introduction aux bases de données et SQL;A201;DAVID GAUDU;B1INFOTP03;
2022-11-18 15:30:00;2022-11-18 17:00:00;PROJET Produire un cahier des tendances;Null;Null;B1ICTP02;
2022-09-23 06:00:00;2022-09-23 07:30:00;TD S. De la recherche de l’idée à la création d'activité à l;B404;SIMON GESCHKE;B2GEMATD;
2022-09-14 06:30:00;2022-09-14 08:30:00;MAT Stratégie de communication globale (fondamentaux);C300;MATEJ MOHORIC;CCRCFIEG;
2022-09-08 11:30:00;2022-09-08 13:30:00;TP S. Déploiement des outils QLIO en tant que technicien 1;A104;Null;B2QLPALTP;
2022-11-29 07:00:00;2022-11-29 08:30:00;UE09 Langues vivantes (LLVE05): Espagnol;B403;REIN TAARAMAE;MLGAB3TD01;
2022-09-20 08:15:00;2022-09-20 10:15:00;MAT Python;A201;DAVID GAUDU;MMS;
2023-01-16 13:30:00;2023-01-16 14:30:00;MAT Conférences - Ateliers professionnels;C300;MARK CAVENDISH;CCRCFI01;
2022-12-16 12:30:00;2022-12-16 16:30:00;TP R. Activités d’un site logistique;A103;ROBERT STANNARD;B2QLPFITD;
2022-09-14 14:30:00;2022-09-14 15:45:00;TD R. Outils statistiques de pilotage d’un process;A101;STEPHEN KUNG;B2QLPFITD;
2022-11-29 16:30:00;2022-11-29 18:00:00;TD R. Communication événementielle et gestion de projet opér;A303;ANDRE LEDUCQ;B2ICTD;
2022-10-04 13:30:00;2022-10-04 15:30:00;TP S. Assistance à la prise de décision relative à la préven;B401;LAURENT FIGNON;B2CJEATP01;
2022-09-14 13:45:00;2022-09-14 15:15:00;TD R. Anglais appliqué aux affaires 1;B404;PHILIPPE THYS;B1GEATD03;
2022-09-28 06:00:00;2022-09-28 08:00:00;TD R. Expression communication 1;B302 grande salle;Null;B2CJEATD;
2023-01-31 07:00:00;2023-01-31 09:00:00;MAT Pilotage informatisé logistique;A103;ROBERT STANNARD;PILALTP01, PILAL;
2023-01-18 07:30:00;2023-01-18 09:00:00;TP S. Mise en conformité d’une organisation dans son environ;B503;PHILIPPE GILBERT;B1CJTP04;
2023-01-19 12:00:00;2023-01-19 14:00:00;Oraux saé;A300;BERNARD HINAULT, JAKOB FUGLSANG;B2INFOCMD, B2INFOCMA;
2022-10-04 07:45:00;2022-10-04 09:15:00;UE01 Evaluation et rattachement à l'exercice (LCCE07) - CM;B400;FEDERICO BAHAMONTES;MLGAB3CM01, DU;
2022-12-09 07:00:00;2022-12-09 08:30:00;TD R. Ressources humaines 1;B505;OCTAVE LAPIZE;B1GEATD01;
2022-09-21 12:00:00;2022-09-21 14:00:00;MAT Design graphique;A202;JAN ULLRICH;CCRCFIEG;
2022-11-21 14:15:00;2022-11-21 15:45:00;TP R. Anglais appliqué aux affaires 1;B300 Learning lab;ROGER KLUGE;B1GEATP06;
2022-11-14 13:00:00;2022-11-14 15:00:00;TD R. Communication des organisations;C303;FERDI KUBLER;B1ICTD;
2022-11-21 09:15:00;2022-11-21 10:15:00;CM R. Traitement numérique des données 1;Amphithéâtre;ALEJANDRO VALVERDE;B2GC2FCM, B2GEMACM;
2022-11-30 10:30:00;2022-11-30 11:30:00;CM R. Psychologie sociale 1;Amphithéâtre;MARK PADUN;B1GEACM;
2022-11-25 14:15:00;2022-11-25 15:15:00;PROJET Produire un cahier des tendances;Null;Null;B1ICTP01;
2022-11-09 14:00:00;2022-11-09 16:00:00;CM R. Organisations professionnelles;C303;JULIAN ALAPHILIPPE;B1ICCM;
2022-11-28 07:00:00;2022-11-28 08:30:00;PROJET De la recherche de l’idée à la création d'activité à;Null;Null;B2GEMAALT;
2023-01-09 10:30:00;2023-01-09 11:00:00;Tiers Temps 30min;Amphithéâtre;FEDERICO BAHAMONTES;B1GEATD01, B1GEATD02, B1GEATD03;
2022-09-20 06:00:00;2022-09-20 07:30:00;TD R. Outils et pilotage de l’organisation : Financement;B505;EGAN BERNAL;B2GEMATD;
2022-12-15 07:00:00;2022-12-15 11:00:00;PROJET Immersion - Qualité;Null;Null;B1QLIOTP02;
2022-10-11 13:15:00;2022-10-11 14:15:00;CM R. Sciences de l'Information et de la Communication;C303;MICHAEL MATTHEWS;B1ICCM;
2023-01-04 12:00:00;2023-01-04 14:00:00;TP R. Management d’activités : Management opérationnel;A200;NACER BOUHANNI;B2GEMATP02;
2022-11-29 12:30:00;2022-11-29 14:00:00;MAT Projet personnel et professionnel;A400 Learning lab;BERNARD HINAULT;MIF;
2022-10-06 08:30:00;2022-10-06 09:30:00;PROJET Rédaction professionnelle au sein d’une organisation;Null;Null;B1CJTP04;
2022-09-19 06:00:00;2022-09-19 08:00:00;TD S. Déploiement des outils QLIO en tant que technicien 1;A102;Null;B2QLPFITD;
2022-11-24 12:00:00;2022-11-24 13:00:00;PROJET Formulation d'un conseil juridiques\, comptable\, finan;Null;Null;B1CJTP03;
2022-11-29 08:00:00;2022-11-29 10:00:00;PROJET Proposer une recommandation sur la stratégie de commu;Null;Null;B2ICTP02;
2022-09-06 07:00:00;2022-09-06 08:00:00;TP S. Portfolio 1;Null;PRIMOZ ROGLIC;B2CJEATP02;
2023-02-01 13:00:00;2023-02-01 15:00:00;PROJET Construire une stratégie de communication numérique;Null;Null;B2ICTP02;
2022-10-04 06:30:00;2022-10-04 08:00:00;MATI Analyse de l’image de l’entreprise;C300;Null;CCRCFIEG;
2022-11-30 08:15:00;2022-11-30 09:30:00;TP R. Développement web;A304;JAKOB FUGLSANG;B2INFOTPA3, B2INFOTPD;
2022-11-23 13:15:00;2022-11-23 15:15:00;PROJET Proposer une recommandation sur la stratégie de commu;Null;Null;B2ICTP02;
2022-11-17 07:00:00;2022-11-17 08:30:00;MAT R. Analyse financière;B302 grande salle;GINO BARTALI;B2CJPFTD;
2022-11-18 08:15:00;2022-11-18 09:30:00;TP R. SQL dans un langage de programmation;A304;JAKOB FUGLSANG;B2INFOTPA2;
2023-01-05 16:00:00;2023-01-05 18:00:00;UE14 Gestion et financement de l’activité professionnelle;B504;ADRIEN PETIT;BANQUE;
2022-09-16 07:15:00;2022-09-16 08:30:00;TD R. Anglais 1;B501 Labo 1;JONAS VINGEGAARD;B2INFOTDA1;
2023-01-27 12:00:00;2023-01-27 13:15:00;TP R. Développement d'applications avec IHM;A205;DAVID GAUDU;B1INFOTP03;
2022-12-07 13:30:00;2022-12-07 15:00:00;MAT R. Gestion opérationnelle des RH 1;C302 (salle en U);JEAN ROBIC;B2GEMAALT;
