date_debut;date_fin;intitule;salle;professeur;groupe
03/01/2023 | 12:30:00;10/30/202 | 01:53:00;Controle Introduction Generale au Droit;Amphitheatre;LUCIEN VAN IMPE;UBCAA1CM;
07/09/2022 | 09:00:00;90/20/202 | 01:01:50;CM R. Outils statistiques de pilotage d'un process;A101;STEPHEN KUNG;B2QLPFICM;
04/01/2023 | 12:30:00;10/30/202 | 01:43:00;TP R. Outils\, methodes et communication pour la qualite;A105;STEPHEN KUNG;B1QLIOTP01;
16/11/2022 | 08:45:00;11/21/202 | 01:01:50;TD S. Mettre en oeuvre une organisation comptable et fiscale;A302;NELSON OLIVEIRA;B1GEATD02;
10/01/2023 | 07:00:00;11/30/202 | 00:90:00;MAT Traitement de l'information;None;GIANNI MOSCON;MIF;
09/11/2022 | 12:00:00;10/21/202 | 01:33:00;CM R. Droit fiscal 1;B500;BUT2 CJ PF;B2CJEACM;
16/11/2022 | 15:00:00;11/21/202 | 01:60:00;TP S. Portfolio 1;None;Inconnu;B2CJPFTP02;
