date_debut;date_fin;intitule;salle;professeur;groupe
2023-01-03 12:30:00;2023-01-03 15:30:00;Contrôle Introduction Générale au Droit;Amphithéâtre;LUCIEN VAN IMPE;Null;
2022-09-07 09:00:00;2022-09-07 10:15:00;CM R. Outils statistiques de pilotage d’un process;A101;STEPHEN KUNG;B2QLPFICM;
2023-01-04 12:30:00;2023-01-04 14:30:00;TP R. Outils\, méthodes et communication pour la qualité;A105;STEPHEN KUNG;B1QLIOTP01;
2022-11-16 08:45:00;2022-11-16 10:15:00;TD S. Mettre en œuvre une organisation comptable et fiscale;A302;NELSON OLIVEIRA;B1GEATD02;
2023-01-10 07:00:00;2023-01-10 09:00:00;MAT Traitement de l’information;Null;GIANNI MOSCON;MIF;
2022-11-09 12:00:00;2022-11-09 13:30:00;CM R. Droit fiscal 1;B500;SONNY COLBRELLI;B2CJEACM;
2022-11-16 15:00:00;2022-11-16 16:00:00;TP S. Portfolio 1;Null;Null;B2CJPFTP02;
2022-11-23 09:45:00;2022-11-23 11:00:00;PROJET Développement d'une application;A205;Null;B2INFOTPA2;
2022-10-05 06:00:00;2022-10-05 07:30:00;TP R. Finance;B503;HENRI PELISSIER;B2GC2FTP02;
2023-01-13 14:30:00;2023-01-13 16:00:00;MAT R. Comptabilité générale 2;B506;GINO BARTALI;B1CJTD02;
2023-01-03 07:00:00;2023-01-03 09:00:00;TP R. Outils\, méthodes et communication pour la qualité;A105;STEPHEN KUNG;B1QLIOTP01;
2022-09-12 11:30:00;2022-09-12 12:45:00;TP R. Outils numériques;A102;ALEJANDRO VALVERDE;B1QLIOTP02;
2022-10-20 11:15:00;2022-10-20 12:30:00;PROJET Installation d'un poste pour le développement;A500;Null;B1INFOTP02;
2022-09-14 06:30:00;2022-09-14 08:00:00;MAT Gestion de projet;A103;DYLAN TEUNS;PILAL;
2022-09-15 14:45:00;2022-09-15 16:15:00;MAT Médiaplanning;A202;ALEXANDER KRISTOFF;CCRCFIEG;
2022-09-28 06:30:00;2022-09-28 08:00:00;MAT Système d’information logistique;A103;NACER BOUHANNI;PILAL;
2023-02-02 07:00:00;2023-02-02 08:30:00;MAT R. Procédure pénale;B302 grande salle;SONNY COLBRELLI;B2CJPFCM;
2022-10-03 15:00:00;2022-10-03 16:15:00;TP R. Initiation au développement;A201;ANDY SCHLECK;B1INFOTP02;
2022-10-17 15:00:00;2022-10-17 16:30:00;PROJET Portfolio 1;Null;Null;B2CJEATP02;
2022-12-03 11:00:00;2022-12-03 12:00:00;PROJET Formulation d'un conseil juridiques\, comptable\, finan;Null;Null;B1CJTP04;
2022-11-21 11:00:00;2022-11-21 11:30:00;Tiers-temps : CC Droit social;B400;Null;DU, MLGAB3TD01;
2022-09-15 09:00:00;2022-09-15 11:00:00;TD S. Assistance prise décision;B401;ALBERTO BETTIOL;B2CJPFTD;
2022-10-06 11:00:00;2022-10-06 12:30:00;PROJET Situer une organisation dans son environnement;Null;Null;B1GEATP05;
2023-01-25 09:45:00;2023-01-25 11:45:00;MAT R. Outils numériques et de communication 2;Null;MARCO PANTANI;B1CJTP03;
2022-12-16 07:00:00;2022-12-16 08:30:00;PROJET Mettre en œuvre une organisation comptable et fiscale;Null;Null;B1GEATP02;
2022-09-08 06:00:00;2022-09-08 07:30:00;TD R. Anglais appliqué aux affaires 1;B501 Labo 1;ROGER KLUGE;B2GC2FTD;
2022-11-25 09:30:00;2022-11-25 11:30:00;PROJET Concevoir et organiser un événement;Null;Null;B2ICTP02;
2022-12-06 09:30:00;2022-12-06 10:45:00;TP R. Introduction aux bases de données et SQL;A304;ALBERTO CONTADOR;B1INFOTP01;
2022-09-13 07:45:00;2022-09-13 09:45:00;MAT Comptabilité approfondie;B400;FEDERICO BAHAMONTES;DU, MLGAB3TD01;
2023-02-02 07:00:00;2023-02-02 08:30:00;CM S. Mise en conformité d’une organisation dans son environ;B500;CALEB EWAN;B1CJCM;
2022-09-06 06:00:00;2022-09-06 07:30:00;MAT R. Gestion de la paie;A200;OTTAVIO BOTTECCHIA;B2GC2FTD;
2023-01-04 07:00:00;2023-01-04 09:00:00;TP R. Ordonnancement\, lancement et pilotage;A102;ARNAUD DEMARE;B2QLPFITD;
2022-11-26 11:00:00;2022-11-26 12:00:00;PROJET Sécurisation des activités d’une organisation;Null;Null;B1CJTP02;
2023-01-25 12:30:00;2023-01-25 13:45:00;TD R. Prévision et planification de la distribution;A103;ROBERT STANNARD;B2QLPFITD;
2022-10-18 13:45:00;2022-10-18 15:00:00;TP R. Introduction à l'architecture des ordinateurs;A303;SAM BENNET;B1INFOTP03;
2022-12-06 07:00:00;2022-12-06 11:00:00;PROJET Immersion - Organisation;Null;Null;B1QLIOTP02;
2023-01-09 09:15:00;2023-01-09 11:15:00;MAT S. Organisation d’une situation de production;A104;DYLAN TEUNS;B1QLIOTP02;
2023-01-16 10:00:00;2023-01-16 11:15:00;CM R. Organisation des données techniques et économiques;A100;NACER BOUHANNI;B1QLIOCM;
2022-10-07 10:45:00;2022-10-07 11:45:00;CM R. Outils mathématiques de gestion 1;Amphithéâtre;HUGO KOBLET;B1GEACM;
2022-11-10 09:30:00;2022-11-10 10:45:00;TP R. Introduction aux systèmes d'exploitation et à leur fon;A304;DAVID GAUDU;B1INFOTP04;
2022-12-14 10:30:00;2022-12-14 11:30:00;TD S. Contribution aux activités de pilotage et de conseil;B401;RUDY MOLARD;B2CJEATD;
2022-09-09 10:45:00;2022-09-09 11:45:00;MAT R. Institutions publiques 1;B500;CALEB EWAN;B1CJCM;
2022-09-12 06:00:00;2022-09-12 07:15:00;CM R. Organisation du système de production;A100;STEPHEN KUNG;B1QLIOCM;
2023-01-27 09:45:00;2023-01-27 11:15:00;UE11 Gestion budgét. et prix de cession interne (LCCE11)-TD;B403;Null;MLGAB3TD01;
2023-01-25 15:00:00;2023-01-25 17:00:00;TD R. Anglais appliqué aux domaines professionnels LV1 : N2;B501 Labo 1;ROGER WALKOWIAK;B1CJTD01;
2022-10-24 15:30:00;2022-10-24 16:00:00;Suivi recherche du stage;B301 grande salle;WOUT VAN AERT;B2INFOCMD, B2INFOCMA;
2022-11-09 12:00:00;2022-11-09 13:15:00;TP R. Initiation au développement;A300;ANDY SCHLECK;B1INFOTP01;
2022-09-23 08:15:00;2022-09-23 10:15:00;TD R. Marketing / Webmarketing;C303;LUCIEN AIMAR;B2ICTD;
2023-01-17 10:00:00;2023-01-17 11:15:00;CM R. Organisation d’un poste et d’un atelier;A100;DYLAN TEUNS;B1QLIOCM;
2022-10-17 11:45:00;2022-10-17 13:15:00;UE01 Evaluation et rattachement à l'exercice (LCCE07) - CM;B400;FEDERICO BAHAMONTES;MLGAB3CM01, DU;
2022-10-24 07:00:00;2022-10-24 08:30:00;MAT Stratégie de communication interne;A400 Learning lab;BERNARD HINAULT;CCRCFIEG;
2022-11-16 07:15:00;2022-11-16 09:15:00;MAT R. Outils numériques et de communication 1;A201;MAURICE GARIN;B1CJTP01;
2022-10-28 09:00:00;2022-10-28 10:15:00;TP R. Projet Personnel et Professionnel 1;A307;JONAS VINGEGAARD;B1QLIOTP01;
2022-12-02 12:30:00;2022-12-02 14:30:00;TD R. Management d’activités : Management opérationnel;A100;NACER BOUHANNI;B2GEMAALT;
2022-10-13 07:45:00;2022-10-13 09:15:00;TD R. Environnement économique 1;B505;PIERRE ROLLAND;B1GEATD03;
2022-09-19 14:00:00;2022-09-19 15:30:00;TD R. Management d’activités 1;B402;MATTHIEU LADAGNOUS;B2GEMATD;
2022-12-15 07:00:00;2022-12-15 09:00:00;PROJET Concevoir un dispositif de communication hybridant;A400 Learning lab\,C200 Salle Infocom;Null;B2ICTP02;
2022-12-12 07:00:00;2022-12-12 08:30:00;MAT R. Comptabilité générale 1;B507;LEON SCIEUR;B1CJTD02;
2022-10-18 11:45:00;2022-10-18 13:15:00;MAT R. Droit de l’environnement;B302 grande salle;LAURENT FIGNON;B2CJPFCM;
2022-11-14 08:00:00;2022-11-14 10:00:00;TD R. Introduction générale au droit;B507;LUCIEN VAN IMPE;B1CJTD02;
2022-10-27 07:00:00;2022-10-27 10:30:00;TP R. Aide aux apprentissages 1;Null;ROGER KLUGE;B1GEATP06;
2022-09-20 13:30:00;2022-09-20 15:00:00;MAT R. Projet Personnel et Professionnel 1;A203;OSCAR PEREIRO;B1GEATP06;
2023-01-24 09:00:00;2023-01-24 11:00:00;MAT R. Droit de l’urbanisme 2.0;B506;LAURENT FIGNON;B2CJPFCM;
2022-12-02 12:45:00;2022-12-02 14:15:00;TD R. Fiscalité : Imposition du résultat des entreprises rel;B505;HENRI PELISSIER;B2GC2FTD;
2022-09-08 06:00:00;2022-09-08 07:00:00;CM R. Management des systèmes d’information;B302 grande salle;JAKOB FUGLSANG;B2INFOCMA, B2INFOCMD;
2022-09-13 13:30:00;2022-09-13 14:45:00;TD R. Introduction à l'architecture des ordinateurs;A303;SAM BENNET;B1INFOTD01;
2022-10-14 06:30:00;2022-10-14 08:00:00;MAT Contrôle de gestion;B404;VALENTIN MADOUAS;DU;
2022-11-08 12:15:00;2022-11-08 13:45:00;MAT R. Droit des biens publics;B500;LAURENT FIGNON;B2CJEACM;
2022-09-17 11:00:00;2022-09-17 13:00:00;PROJET Assistance à la prise de décision relative à la préve;Null;Null;B2CJEATP01;
2022-09-20 09:00:00;2022-09-20 10:30:00;TP R. Expression/Communication et culture générale 1;A203;OSCAR PEREIRO;B1GEATP01;
2022-11-08 16:30:00;2022-11-08 17:30:00;PROJET Fonctions et activités juridiques\, comptables\, financ;Null;Null;B1CJTP02;
2022-10-17 07:45:00;2022-10-17 09:15:00;MAT R. Projet Personnel et Professionnel 1;C302 (salle en U);MARK PADUN;B2GEMAALT;
2023-01-13 09:15:00;2023-01-13 11:15:00;MAT R. Enjeux économiques et sociaux;B506;REIN TAARAMAE;B1CJTD02;
2022-11-16 14:00:00;2022-11-16 15:00:00;TP S. Portfolio 1;Null;Null;B2CJPFTP02;
2022-10-14 08:15:00;2022-10-14 09:45:00;UE13 Analyse comptable et financière du client professionnel;B504;OCTAVE LAPIZE;BANQUE;
2022-11-09 07:00:00;2022-11-09 08:30:00;TP R. Comptabilité 1 : Techniques de base de comptabilité;B504;FEDERICO BAHAMONTES;B2GC2FTP01;
2022-10-12 13:45:00;2022-10-12 15:45:00;TP R. Expression et communication 1;B507;OSCAR PEREIRO;B1CJTP02;
2022-11-16 12:45:00;2022-11-16 14:15:00;UE02 Analyse de la performance (LCCE08) - CM;B400;MATTHIEU LADAGNOUS;MLGAB3CM01, DU;
2022-10-13 09:30:00;2022-10-13 11:00:00;TD R. Management d’activités 1;B505;OCTAVE LAPIZE;B1GEATD02;
2022-09-14 15:00:00;2022-09-14 16:15:00;TP R. Initiation au développement;A300;ANDY SCHLECK;B1INFOTP01;
2022-10-11 09:30:00;2022-10-11 11:00:00;TD R. Management d’activités : Business Model;B404;SIMON GESCHKE;B2GEMATD;
2022-12-12 09:30:00;2022-12-12 11:00:00;TD R. Fiscalité : Imposition du résultat des entreprises rel;B403;HENRI PELISSIER;B2GC2FTD;
2022-10-19 07:45:00;2022-10-19 09:15:00;TP R. Finance;A204;HENRI PELISSIER;B2GC2FTP01;
2022-11-25 08:45:00;2022-11-25 10:15:00;PROJET Mettre en œuvre une organisation comptable et fiscale;Null;Null;B1GEATP01;
2022-10-26 13:45:00;2022-10-26 15:00:00;TP Développement web;A300;Null;B1INFOTP01;
2023-02-02 14:45:00;2023-02-02 16:45:00;MAT Multimédia : intégration du son\, de l’image\, de la vidéo;A201;MATHIEU VAN DER POEL;MMS;
2022-09-30 07:45:00;2022-09-30 09:15:00;TD R. Environnement économique 1;B503;PIERRE ROLLAND;B1GEATD01;
2022-12-15 09:15:00;2022-12-15 10:45:00;TD R. Environnement juridique 1;B402;GUSTAVE GARRIGOU;B2GEMATD;
2023-01-06 08:45:00;2023-01-06 10:15:00;MAT R. Projet Personnel et Professionnel 1;A203;OSCAR PEREIRO;B1GEATP06;
2022-10-03 12:15:00;2022-10-03 13:45:00;TP R. Traitement numérique des données 1;A200;THIBAUT PINOT;B2GEMATP01;
2022-11-30 07:00:00;2022-11-30 08:30:00;TD R. Expression/communication et culture générale 1;C302 (salle en U);OSCAR PEREIRO;B2GEMAALT;
2022-12-13 09:30:00;2022-12-13 10:45:00;PROJET Comparaison d'approches algorithmiques;A303;Null;B1INFOTP04;
2022-11-07 12:15:00;2022-11-07 13:30:00;TD S. Développement d'une application;A304;JONAS VINGEGAARD;B2INFOTDA1;
2023-01-16 14:45:00;2023-01-16 16:45:00;TP S. Projet Supply Chain en tant que technicien 1;A105;DYLAN TEUNS;B2QLPALTP;
2022-12-13 12:30:00;2022-12-13 14:00:00;Début Evaluation SAE Etudier et comparer des stratégies de com;C303;FERDI KUBLER, ALEXANDER KRISTOFF;Null;
2022-10-24 11:45:00;2022-10-24 13:15:00;TD R. Environnement sociologique;B404;MARK PADUN;B1GEATD02;
2022-10-25 08:30:00;2022-10-25 09:45:00;TP R. Introduction aux bases de données et SQL;A304;ALBERTO CONTADOR;B1INFOTP03;
2023-01-11 09:15:00;2023-01-11 11:15:00;MAT S. Résolution de problèmes;A100;CLEMENT RUSSO;B1QLIOTP01;
2023-01-12 12:30:00;2023-01-12 14:00:00;MAT Projet personnel et professionnel;A103;BERNARD HINAULT;PILAL;
2022-11-30 12:45:00;2022-11-30 14:45:00;TP S. Formulation d’un conseil juridique\, comptable\, financi;B502 Labo 2;PRIMOZ ROGLIC;B1CJTP02;
2022-09-19 13:15:00;2022-09-19 14:45:00;CM R. Droit administratif;B507;LAURENT FIGNON;B2CJEACM;
2022-10-27 06:00:00;2022-10-27 07:30:00;UE02 Analyse de la performance (LCCE08) - TD;B403;VALENTIN MADOUAS;MLGAB3TD01;
2022-11-16 08:45:00;2022-11-16 10:45:00;PROJET Concevoir et organiser un événement;Null;Null;B2ICTP02;
2022-12-09 09:15:00;2022-12-09 11:15:00;TP R. Expression communication 1;B401;OSCAR PEREIRO;B2CJEATP01;
2022-11-26 08:00:00;2022-11-26 09:00:00;PROJET Sécurisation des activités d’une organisation;Null;Null;B1CJTP04;
2022-10-06 08:30:00;2022-10-06 09:45:00;TD R. Management des systèmes d’information;A304;JAKOB FUGLSANG;B2INFOTDA1;
2022-11-18 09:15:00;2022-11-18 11:15:00;TD R. Démarches d’amélioration;A104;BINIAM GIRMAY;B2QLPALTD;
2022-10-19 06:30:00;2022-10-19 08:30:00;MAT Stratégie de communication globale (fondamentaux);C300;MATEJ MOHORIC;CCRCFIEG;
2023-01-11 15:15:00;2023-01-11 17:15:00;TD R. Anglais appliqué aux domaines professionnels LV1 : N2;B502 Labo 2;ROGER WALKOWIAK;B1CJTD01;
2023-01-20 08:00:00;2023-01-20 09:30:00;Contrôle Finance : Diagnostic fiancier;Amphithéâtre;OCTAVE LAPIZE;B2GC2FTD;
2022-09-30 14:15:00;2022-09-30 15:45:00;TD R. De la recherche de l’idée à la création d’activité;C302 (salle en U);EGAN BERNAL;B2GEMAALT;
2022-11-16 07:15:00;2022-11-16 09:15:00;TD R. Expression et communication 1;B506;LOUIS TROUSSELIER;B1CJTD02;
2022-11-18 11:45:00;2022-11-18 13:15:00;TP R. Outils mathématiques de gestion 1;B402;HUGO KOBLET;B1GEATP03;
2023-02-01 09:00:00;2023-02-01 11:00:00;Projet professionnal individuel & international day;B400;ALAIN BOILEAU;MLGAB3TD01;
2022-09-30 06:00:00;2022-09-30 07:30:00;PROJET Portfolio 1;Null;Null;B2CJEATP01;
2022-11-09 07:00:00;2022-11-09 08:30:00;MAT R. Comptabilité générale 1;B505;LEON SCIEUR;B1CJTD02;
2022-10-28 13:15:00;2022-10-28 14:45:00;TP R. Anglais appliqué aux domaines professionnels 1 : N3;B506;NICOLAS FRANTZ;B2CJEATP01;
2023-01-12 08:15:00;2023-01-12 09:30:00;TP S. Comparaison d'approches algorithmiques;A304;WOUT VAN AERT;B1INFOTP04;
2022-10-11 15:15:00;2022-10-11 16:45:00;PROJET Portfolio 1;Null;Null;B2CJPFTP02;
2022-10-03 06:15:00;2022-10-03 08:15:00;TD R. Publication assistée par ordinateur (PAO);A202;MICHAEL WOODS;B1ICTD;
2022-10-18 11:15:00;2022-10-18 12:45:00;TP R. Anglais appliqué aux affaires 1;B300 Learning lab;ROGER KLUGE;B1GEATP06;
2022-12-06 08:00:00;2022-12-06 08:30:00;Cryptographie et sécurité;B302 grande salle;PETER SAGAN;B2INFOCMA, B2INFOCMD;
2023-01-30 08:00:00;2023-01-30 09:30:00;CM R. Droit des sociétés;B401;ALBERTO BETTIOL;B2CJPFCM;
2022-11-28 07:00:00;2022-11-28 08:15:00;PROJET Développement d'une application;A205;Null;B2INFOTPA3, B2INFOTPD;
2022-09-29 06:00:00;2022-09-29 07:30:00;PROJET Contribuer au développement ou à la création d'une or;Null;Null;B2GEMAALT;
2022-11-08 10:00:00;2022-11-08 11:15:00;TD R. Identification des flux physiques et d’information;A100;NACER BOUHANNI;B1QLIOTD;
2022-09-22 08:45:00;2022-09-22 10:15:00;UE02 Analyse de la performance (LCCE08) - CM;B400;MATTHIEU LADAGNOUS;MLGAB3CM01, DU;
2023-01-09 12:00:00;2023-01-09 13:30:00;TP R. Outils et pilotage de l’organisation : Financement;B404;OCTAVE LAPIZE;B2GEMATP02;
2022-11-08 07:00:00;2022-11-08 08:15:00;TD S. Développement d'une application;A304;JAKOB FUGLSANG;B2INFOTDA2, B2INFOTDD;
2022-09-21 12:15:00;2022-09-21 13:30:00;TP R. Initiation au développement;A300;ANDY SCHLECK;B1INFOTP01;
2022-11-14 14:45:00;2022-11-14 16:00:00;TD Anglais;B501 Labo 1;Null;B1INFOTD01;
2023-01-09 14:00:00;2023-01-09 17:30:00;PROJET Développement d'une application;B301 grande salle\,A203\,A205;Null;B2INFOTPA1, B2INFOTPA2, B2INFOTPA3, B2INFOTPD;
2022-10-17 12:00:00;2022-10-17 13:30:00;CM S. Mettre en œuvre une organisation comptable et fiscale;Amphithéâtre;GINO BARTALI;B1GEACM;
2022-11-17 14:30:00;2022-11-17 16:00:00;MAT Webmarketing;A203;MIGUEL ANGEL LOPEZ;CCRCFI01;
2022-11-08 12:00:00;2022-11-08 13:30:00;UE06 Sociétés des capitaux (LDRT10) - CM;B400;SONNY COLBRELLI;MLGAB3CM01, DU;
2022-10-04 08:30:00;2022-10-04 10:00:00;TD R. Environnement sociologique;B403;MARK PADUN;B1GEATD03;
2023-01-23 16:15:00;2023-01-23 17:30:00;TP R. Développement pour applications mobiles;A304;WOUT VAN AERT;B2INFOTPA3;
2023-01-16 14:30:00;2023-01-16 15:30:00;MAT Conférences - Ateliers professionnels;C300;MARK CAVENDISH;CCRCFI01;
2023-01-27 12:30:00;2023-01-27 14:30:00;MAT Introduction aux frameworks : JEE\, PHP;A201;ALEKSANDR VLASOV;MMS;
2022-11-22 12:00:00;2022-11-22 14:00:00;TP S. Sécurisation des activités d’une organisation;B500;LUCIEN VAN IMPE;B1CJTP04;
2022-12-05 14:00:00;2022-12-05 15:00:00;Tiers-temps : CT Comptabilité approfondie;B400;Null;Null;
2022-09-08 11:00:00;2022-09-08 13:00:00;MAT Algorithmique et programmation;A201;ANDY SCHLECK;MMS;
2022-12-16 12:30:00;2022-12-16 16:30:00;PROJET Immersion - Qualité;Null;Null;B1QLIOTP02;
2022-10-03 12:45:00;2022-10-03 14:00:00;TP R. Communication professionnelle;A303;BERNARD HINAULT;B2INFOTPA1;
2023-01-04 08:45:00;2023-01-04 10:15:00;TD R. Traitement numérique des données 1;A200;THIBAUT PINOT;B2GEMAALT;
2023-01-24 08:30:00;2023-01-24 09:30:00;TD R. Management avancé des systèmes d’information;A300;NACER BOUHANNI;B2INFOTDD;
2023-02-03 08:45:00;2023-02-03 10:15:00;TD R. Outils et pilotage de l’organisation : Business plan;B401;GASTONE NENCINI;B2GEMATD;
2022-09-29 07:15:00;2022-09-29 08:30:00;TP R. Initiation au développement;A304;ANDY SCHLECK;B1INFOTP02;
2023-01-30 14:30:00;2023-01-30 16:00:00;UE13 Imposition du résultat des entreprises (LCCE12) - CM;B400;HENRI PELISSIER;MLGAB3CM01, DU;
2022-10-17 12:00:00;2022-10-17 13:15:00;TD R. Programmation système;B301 grande salle;ESTEBAN CHAVES;B2INFOTDA2, B2INFOTDD;
2022-10-28 06:30:00;2022-10-28 08:00:00;MAT Informatique avancée;A102;ALEJANDRO VALVERDE;PILAL;
2022-10-04 07:45:00;2022-10-04 09:45:00;TP S. Portfolio 1;B507;PRIMOZ ROGLIC;B1CJTP04;
2022-12-13 14:00:00;2022-12-13 16:00:00;TD S. Etudier et comparer les stratégies de communication de;C303;FERDI KUBLER, ALEXANDER KRISTOFF;B1ICTD;
2023-01-27 12:30:00;2023-01-27 14:00:00;MAT R. Comptabilité générale 2;B506;LEON SCIEUR;B1CJTD01;
2022-11-26 11:30:00;2022-11-26 13:30:00;PROJET Conseil financier et/ou patrimonial;Null;Null;B2CJPFTP02;
2022-10-03 15:00:00;2022-10-03 16:15:00;TP R. Introduction aux bases de données et SQL;A300;DAVID GAUDU;B1INFOTP03;
2022-09-29 08:15:00;2022-09-29 09:45:00;MAT Anglais;B501 Labo 1;JONAS VINGEGAARD;PILAL;
2022-09-26 08:45:00;2022-09-26 10:15:00;UE07 Droit du travail collectif (LDRT11) - TD;B403;GUSTAVE GARRIGOU;MLGAB3TD01;
2023-01-27 09:15:00;2023-01-27 11:15:00;MAT Développement web : PHP\, HTML5\, JavaScript\, CSS\, XML;A200;JAKOB FUGLSANG;MMS;
2023-01-18 09:15:00;2023-01-18 11:15:00;UE9 Fiscalité du client professionnel;B400;JEAN ROBIC;BANQUE;
2022-10-04 13:15:00;2022-10-04 15:15:00;TD R. Anglais 1;B502 Labo 2;NICOLAS FRANTZ;B2ICTD;
2022-12-05 14:15:00;2022-12-05 15:45:00;TD R. Anglais appliqué aux affaires 1;B501 Labo 1;ROGER KLUGE;B1GEATD02;
2022-10-26 13:00:00;2022-10-26 14:15:00;TP R. Expression Communication 1;A307;JULIAN ALAPHILIPPE;B1QLIOTP02;
2022-10-06 11:00:00;2022-10-06 13:00:00;CM R. Communication des organisations;C303;FERDI KUBLER;B1ICCM;
2023-01-11 09:15:00;2023-01-11 11:15:00;CM R. Les fondamentaux de l'animation d'équipe;A101;THOMAS DE GENDT;B2QLPFICM;
2022-10-04 08:30:00;2022-10-04 10:00:00;TP R. Expression/Communication et culture générale 1;A200;THIBAUT PINOT;B1GEATP02;
2022-11-28 07:00:00;2022-11-28 08:00:00;PROJET Sécurisation des activités d’une organisation;Null;Null;B1CJTP04;
2023-01-05 07:45:00;2023-01-05 08:45:00;PROJET Exploiter des données pour analyser des publics et le;C303;Null;B1ICTP02;
2023-01-05 08:00:00;2023-01-05 10:00:00;Contrôle Droit Administratif à l'Amphi;Null;Null;Null;
2022-09-09 13:45:00;2022-09-09 15:15:00;CM R. Droit des personnes et de la famille;B500;LUCIEN VAN IMPE;B1CJCM;
2022-11-16 07:00:00;2022-11-16 08:30:00;TP R. Expression/communication et culture générale 1;A203;OSCAR PEREIRO;B2GC2FTP02;
2022-11-10 12:30:00;2022-11-10 13:45:00;TD S. Installation d'un poste pour le développement;A205;SAM BENNET;B1INFOTD02;
2022-11-21 13:15:00;2022-11-21 14:30:00;TP S. Installation d'un poste pour le développement;A500;PHILIPPE THYS;B1INFOTP03;
2023-02-01 15:15:00;2023-02-01 17:15:00;TP R. Langue vivante 2 – S2;C301;PATRICK KONRAD;B2ICTP02;
2022-09-08 11:30:00;2022-09-08 13:30:00;MAT Contrôle de gestion;B400;GREG LEMOND;DU, MLGAB3TD01;
2022-11-09 09:15:00;2022-11-09 10:15:00;TP R. Recherche d’information et veille;A202;TADEJ POGACAR;B1ICTP02;
2022-12-05 16:00:00;2022-12-05 18:00:00;PROJET Contribution aux activités de pilotage et de conseil;Null;Null;B2CJEATP02;
2022-10-18 13:00:00;2022-10-18 14:30:00;TP R. Outils numériques;A102;ALEJANDRO VALVERDE;B1QLIOTP02;
2022-10-25 07:15:00;2022-10-25 08:15:00;CM R. Introduction aux bases de données et SQL;B301 grande salle;ALBERTO CONTADOR;B1INFOCM;
2022-11-10 09:45:00;2022-11-10 11:15:00;TD R. Etudes des organisations;C303;JULIAN ALAPHILIPPE;B1ICTD;
2022-09-20 06:30:00;2022-09-20 07:30:00;CM R. Architecture des réseaux;B301 grande salle;ESTEBAN CHAVES;B2INFOCMA, B2INFOCMD;
2022-11-25 15:00:00;2022-11-25 17:00:00;MAT R. Stratégies d’apprentissages et de réussite 1;Null;Null;B1CJTP02;
2022-11-15 14:15:00;2022-11-15 15:45:00;TP R. Expression/Communication et culture générale 1;B403\,B502 Labo 2;OSCAR PEREIRO;B1GEATP01;
2022-10-18 13:00:00;2022-10-18 14:15:00;TP R. Coordination approvisionnements - production;A104;ROBERT STANNARD;B2QLPFITD;
2022-10-25 12:15:00;2022-10-25 13:30:00;TP R. Introduction aux bases de données et SQL;A304;ALBERTO CONTADOR;B1INFOTP02;
2023-01-31 08:30:00;2023-01-31 09:45:00;TD R. Graphes;A305;SAM BENNET;B1INFOTD02;
2023-01-09 14:00:00;2023-01-09 16:15:00;Evaluation SAE Synthèse documentaire;C303;JULIAN ALAPHILIPPE, TADEJ POGACAR;Null;
2022-10-13 07:30:00;2022-10-13 08:45:00;TP R. Coordination approvisionnements - production;A307;ROBERT STANNARD;B2QLPFITD;
2022-09-22 08:45:00;2022-09-22 10:15:00;MAT Bases de données;A203;JACQUES ANQUETIL;CCRCFIIC;
2022-10-05 09:00:00;2022-10-05 10:15:00;TD R. Bases des mathématiques et des statistiques;A100;ALEJANDRO VALVERDE;B1QLIOTD;
2023-02-03 07:30:00;2023-02-03 09:00:00;TD R. Anglais 2;A202;NICOLAS FRANTZ;B2ICTD;
2022-12-10 08:00:00;2022-12-10 09:00:00;PROJET Sécurisation des activités d’une organisation;Null;Null;B1CJTP04;
2022-12-03 13:00:00;2022-12-03 14:00:00;PROJET Formulation d'un conseil juridiques\, comptable\, finan;Null;Null;B1CJTP01;
2023-01-19 14:45:00;2023-01-19 16:45:00;TD R. Conduite d'un projet d'amélioration;A100;NACER BOUHANNI;B2QLPALTD;
2022-11-15 08:45:00;2022-11-15 10:15:00;PROJET De la recherche de l’idée à la création d’activité à;Null;Null;B2GEMATP02;
2022-10-27 14:00:00;2022-10-27 15:30:00;PROJET Contribuer au développement ou à la création d'une or;Null;Null;B2GEMAALT;
2022-11-23 09:15:00;2022-11-23 10:45:00;TD R. Droit commercial;B507;PHILIPPE GILBERT;B2CJEATD;
2022-12-05 16:00:00;2022-12-05 17:30:00;PROJET Mettre en œuvre une organisation comptable et fiscale;Null;Null;B1GEATP01;
2022-11-07 11:15:00;2022-11-07 11:45:00;Tiers-temps : CC Comptabilité approfondie;B400;Null;DU, MLGAB3TD01;
2022-11-08 07:00:00;2022-11-08 09:00:00;MAT Ergonomie\, conception et programmation des IHM;A201;CHRISTOPHE LAPORTE;MMS;
2022-11-07 09:45:00;2022-11-07 10:45:00;CM R. Introduction à la gestion des organisations;B301 grande salle;LEON SCIEUR;B1INFOCM;
2022-09-27 13:45:00;2022-09-27 15:00:00;TP R. Introduction aux bases de données et SQL;A304;ALBERTO CONTADOR;B1INFOTP03;
2022-10-26 07:45:00;2022-10-26 09:45:00;TP R. Outils statistiques de pilotage d’un process;A307;STEPHEN KUNG;B2QLPFITD;
2022-11-07 07:00:00;2022-11-07 08:15:00;TD S. Développement d'une application;A300;PETER SAGAN;B2INFOTDA2, B2INFOTDD;
2023-02-01 16:30:00;2023-02-01 17:30:00;CM Qualité et au-delà du relationnel;B301 grande salle;GUILLAUME MARTIN;B2INFOCMA, B2INFOCMD;
2023-01-05 09:45:00;2023-01-05 11:00:00;TP S. Développement d'une application;A201;JAKOB FUGLSANG;B2INFOTPA3, B2INFOTPD;
2022-10-14 07:30:00;2022-10-14 09:00:00;MAT R. Procédure civile;B400;LUCIEN VAN IMPE;B2CJEACM;
2022-09-15 11:00:00;2022-09-15 13:00:00;CM S. Assistance à la prise de décision relative à la préven;A400 Learning lab;LAURENT FIGNON;B2CJEACM;
2022-12-13 10:00:00;2022-12-13 11:30:00;TP R. Outils mathématiques de gestion 1;B505;LUKE ROWE;B1GEATP01;
2023-01-04 09:45:00;2023-01-04 11:15:00;MAT Marketing direct;A202;LUCIEN AIMAR;CCRCFIIC;
2022-10-05 06:00:00;2022-10-05 07:30:00;TP R. Comptabilité 1 : Techniques de base de comptabilité;A302;FEDERICO BAHAMONTES;B2GC2FTP01;
2022-11-18 08:30:00;2022-11-18 10:30:00;OI PROJET Projet Supply Chain en tant que technicien 1;A101;Null;B2QLPFITD;
2022-10-14 11:30:00;2022-10-14 13:30:00;TP R. Traitement des données;A200;MICHAEL MATTHEWS;B1ICTP01;
2022-09-30 06:00:00;2022-09-30 07:30:00;PROJET Portfolio 1;Null;Null;B2CJPFTP01;
2022-12-16 14:45:00;2022-12-16 16:00:00;PROJET Développement d'une application;B301 grande salle;Null;B2INFOTPA2;
2022-10-07 07:15:00;2022-10-07 08:45:00;TD R. Introduction aux Systèmes de Management de la Qualité;A100;TADEJ POGACAR;B1QLIOTD;
2022-11-26 10:00:00;2022-11-26 11:00:00;PROJET Sécurisation des activités d’une organisation;Null;Null;B1CJTP03;
2022-12-12 16:00:00;2022-12-12 17:30:00;PROJET Mettre en œuvre une organisation comptable et fiscale;Null;Null;B1GEATP02;
2023-01-13 07:30:00;2023-01-13 08:30:00;PROJET Concevoir et organiser un événement;Null;Null;B2ICTP02;
2023-02-02 14:15:00;2023-02-02 16:45:00;UE9 Fiscalité du client professionnel;B504;JEAN ROBIC;BANQUE;
2022-11-21 12:30:00;2022-11-21 14:00:00;TD R. Comptabilité 1;B505;GREG LEMOND;B1GEATD01;
2022-10-10 11:00:00;2022-10-10 12:15:00;TP S. Découverte de l'environnement économique et écologique;A305;LEON SCIEUR;B1INFOTP02;
2022-09-10 06:00:00;2022-09-10 08:00:00;PROJET Assistance à la prise de décision d’un client ou d'un;Null;Null;B2CJPFTP02;
2022-10-07 06:00:00;2022-10-07 07:00:00;CM R. Introduction aux systèmes d'exploitation et à leur fon;B301 grande salle;DAVID GAUDU;B1INFOCM;
