date_debut;date_fin;intitule;salle;professeur;groupe
2022-10-05 06:30:00;2022-10-05 08:00:00;TD R. Expression et communication 1;B507;LOUIS TROUSSELIER;B1CJTD02;
2023-01-25 12:00:00;2023-01-25 16:30:00;UE5 Marchés financiers;B400;WARREN BARGUIL;BANQUE;
2022-10-20 12:00:00;2022-10-20 14:00:00;MAT Bases de données;A203;JACQUES ANQUETIL;CCRCFIIC;
2022-12-02 13:15:00;2022-12-02 14:45:00;PROJET Contribuer au développement ou à la création d'une or;Null;Null;B2GEMATP02;
2022-10-11 13:30:00;2022-10-11 15:00:00;TP R. Comptabilité 1;B404;GREG LEMOND;B1GEATP02;
2022-11-25 13:45:00;2022-11-25 15:15:00;TD R. Anglais appliqué aux affaires 1;C302 (salle en U);PHILIPPE THYS;B2GEMAALT;
2022-12-03 16:00:00;2022-12-03 17:00:00;PROJET Formulation d'un conseil juridiques\, comptable\, finan;Null;Null;B1CJTP02;
2022-11-29 08:15:00;2022-11-29 09:30:00;TP R. Qualité de développement;A205;GUILLAUME MARTIN;B2INFOTPA2;
2022-10-24 13:30:00;2022-10-24 15:00:00;PROJET Construire une posture professionnelle;Null;Null;B1GEATP06;
2022-10-05 13:45:00;2022-10-05 15:15:00;MAT R. Outils numériques et de communication 1;A203;SAM BENNET;B2CJPFTD;
2022-09-12 11:00:00;2022-09-12 12:15:00;TD R. Introduction à l’économie durable et numérique;A301;LEON SCIEUR;B1INFOTD02;
2022-09-28 14:00:00;2022-09-28 15:30:00;TD R. Management d’activités 1;B403;MATTHIEU LADAGNOUS;B2GC2FTD;
2023-01-25 07:30:00;2023-01-25 09:00:00;TP R. Anglais 2;C303;NICOLAS FRANTZ;B2ICTP02;
2022-11-24 07:00:00;2022-11-24 08:00:00;CM R. Gestion de projet;Amphithéâtre;GREG LEMOND;B1GEACM;
2022-10-05 15:30:00;2022-10-05 16:30:00;PROJET Rédaction professionnelle au sein d’une organisation;Null;Null;B1CJTP02;
2022-12-01 10:00:00;2022-12-01 11:15:00;PROJET Développement d'une application;A205;Null;B2INFOTPA2;
2022-12-15 09:30:00;2022-12-15 11:30:00;CM R. Projet personnel et professionnel 1;B500;LUCIEN VAN IMPE;B1CJCM;
2022-10-26 06:30:00;2022-10-26 08:00:00;UE02 Analyse de la performance (LCCE08) - CM;B400;MATTHIEU LADAGNOUS;MLGAB3CM01, DU;
2023-01-03 14:30:00;2023-01-03 15:45:00;PROJET Développement d'une application;A205;Null;B2INFOTPA1;
2023-01-26 14:45:00;2023-01-26 16:15:00;MAT E-commerce;A202;MIGUEL ANGEL LOPEZ;CCRC;
2022-12-15 08:45:00;2022-12-15 10:15:00;TD R. Comptabilité 1 : Techniques de base de comptabilité ap;B400;FEDERICO BAHAMONTES;B2GC2FTD;
2022-10-25 14:00:00;2022-10-25 15:00:00;Contrôle Contrôle de gestion;Amphithéâtre;GREG LEMOND, OSCAR PEREIRO;B2GC2FTD, B2GEMATD;
2022-10-03 07:45:00;2022-10-03 09:15:00;MAT R. Organisation judiciaire;B500;LUCIEN VAN IMPE;B1CJCM;
2023-01-03 14:00:00;2023-01-03 16:00:00;UE8 Gestion et transmission du patrimoine;B401;WARREN BARGUIL;BANQUE;
2022-11-18 08:45:00;2022-11-18 10:15:00;TD R. Anglais appliqué aux affaires 1;B505;ROGER KLUGE;B1GEATD01;
2022-11-22 13:15:00;2022-11-22 14:45:00;TD R. Environnement économique;B404;PIERRE ROLLAND;B2GC2FTD;
2022-10-19 11:30:00;2022-10-19 13:30:00;MAT R. Outils numériques et de communication 1;A307;MAURICE GARIN;B1CJTP01;
2022-12-12 14:15:00;2022-12-12 15:45:00;TP R. Projet personnel et professionnel 1;Null;Null;B2CJEATP02;
2022-10-07 11:30:00;2022-10-07 13:15:00;TP R. Amélioration d'un poste et d'un atelier;A101;BINIAM GIRMAY;B2QLPFITD;
2022-12-02 09:15:00;2022-12-02 11:15:00;OI TP S. Projet Supply Chain en tant que technicien 1;A105;DYLAN TEUNS;B2QLPFITD;
2022-09-29 06:30:00;2022-09-29 08:00:00;MAT Anglais;B501 Labo 1;JONAS VINGEGAARD;PILAL;
2022-11-30 12:45:00;2022-11-30 14:45:00;TP S. Formulation d’un conseil juridique\, comptable\, financi;B506;LOUIS TROUSSELIER;B1CJTP04;
2022-11-08 16:00:00;2022-11-08 17:15:00;PROJET Implémentation d’un besoin client;A300;Null;B1INFOTP03;
2022-12-06 12:30:00;2022-12-06 14:30:00;TP S. Sécurisation des activités d’une organisation;B500;LAURENT FIGNON;B1CJTP01;
2022-10-10 14:15:00;2022-10-10 15:45:00;MAT Design graphique;A202;JAN ULLRICH;CCRCFIEG;
2022-12-15 12:00:00;2022-12-15 14:00:00;CM R. Sciences de l'Information et de la Communication;B300 Learning lab;MICHAEL MATTHEWS;B1ICCM;
2022-11-21 08:15:00;2022-11-21 09:45:00;CM R. Droit de la responsabilité extracontractuelle;B302 grande salle;LUCIEN VAN IMPE;B2CJEACM;
2022-12-08 08:30:00;2022-12-08 10:00:00;TD R. Anglais appliqué aux affaires 1;B501 Labo 1\,B503;ROGER KLUGE;B2GEMAALT;
2023-01-04 15:15:00;2023-01-04 16:45:00;TD R. Traitement numérique des données 1;B403;SEPP KUSS;B2GEMAALT;
2022-11-25 07:45:00;2022-11-25 11:45:00;Ateliers CJD;Null;Null;LP MC : CC;
2023-01-13 12:30:00;2023-01-13 13:45:00;TD R. Anglais;B501 Labo 1;ROGER KLUGE;B1QLIOTD;
2023-01-12 09:15:00;2023-01-12 11:15:00;TP R. Communication numérique\, webdesign et data management;A203;JAN ULLRICH;B2ICTP02;
2022-09-26 13:00:00;2022-09-26 14:15:00;CM R. Outils statistiques de pilotage d’un process;A101;STEPHEN KUNG;B2QLPFICM;
2022-09-14 07:45:00;2022-09-14 09:15:00;MAT R. Outils numériques de communication 1;A203;THIBAUT PINOT;B1GEATD02;
2022-11-15 14:15:00;2022-11-15 15:45:00;TP R. Comptabilité 1;B503;NELSON OLIVEIRA;B1GEATP06;
2022-12-09 14:45:00;2022-12-09 16:15:00;PROJET Mettre en œuvre une organisation comptable et fiscale;Null;Null;B1GEATP04;
2022-09-16 11:30:00;2022-09-16 13:00:00;TP R. Anglais appliqué aux domaines professionnels 1 : N3;B507;PRIMOZ ROGLIC;B2CJEATP02;
2023-01-09 07:00:00;2023-01-09 08:15:00;TD S. Développement d'une application;A304;WOUT VAN AERT;B2INFOTDA1;
2023-02-01 16:00:00;2023-02-01 18:00:00;trajet bus Cahors;Null;Null;MIF;
2022-11-10 12:00:00;2022-11-10 13:15:00;TD R. Anglais 1;B501 Labo 1;JONAS VINGEGAARD;B2INFOTDA1;
2022-10-21 13:15:00;2022-10-21 14:45:00;MAT Conditionnement / Emballage;A103;TIM WELLENS;PILAL;
2022-10-20 08:45:00;2022-10-20 10:00:00;TP R. Initiation au développement;A201;ANDY SCHLECK;B1INFOTP01;
2022-12-07 07:00:00;2022-12-07 08:30:00;PROJET Contribuer au développement ou à la création d'entrep;Null;Null;B2GC2FTP02;
2022-12-02 07:00:00;2022-12-02 09:30:00;TD S. Concevoir et organiser un événement;A302\,A303;ANDRE LEDUCQ;B2ICTD;
2023-02-01 07:30:00;2023-02-01 09:00:00;MAT Anglais S6;B501 Labo 1;ROGER KLUGE;Null;
2023-01-03 07:30:00;2023-01-03 09:00:00;TD R. Culture numérique;A202;MATTHIEU LADAGNOUS;B2ICTD;
2023-01-11 09:45:00;2023-01-11 11:00:00;PROJET Portfolio 1;A205;Null;B2INFOTPA2;
2022-09-08 11:30:00;2022-09-08 14:30:00;Escape Game de rentrée BUT1 - Obligatoire;Null;Null;B1CJCM, B1ICCM, B1GEACM, B1INFOCM, B1QLIOCM;
2022-12-01 08:45:00;2022-12-01 10:45:00;TP S. Portfolio 1;B508;RUDY MOLARD;B1CJTP02;
2023-01-11 09:45:00;2023-01-11 11:15:00;MAT Management;B404;MATTHIEU LADAGNOUS;DU;
2022-10-25 06:00:00;2022-10-25 07:00:00;UE7 Droit bancaire et droit des assurances;B504;PEDRO DELGADO;BANQUE;
2022-12-09 12:00:00;2022-12-09 14:00:00;MAT Développement web : PHP\, HTML5\, JavaScript\, CSS\, XML;A201;JAKOB FUGLSANG;MMS;
2022-10-19 07:45:00;2022-10-19 09:15:00;MAT R. Outils numériques de communication 1;A203;THIBAUT PINOT;B1GEATD02;
2022-11-30 09:15:00;2022-11-30 11:15:00;CM R. Sciences de l'Information et de la Communication;C303;MICHAEL MATTHEWS;B1ICCM;
2023-01-19 07:00:00;2023-01-19 08:30:00;CM R. Contrats spéciaux;B302 grande salle;ROMAIN BARDET;B2CJEACM;
2022-09-27 12:15:00;2022-09-27 13:45:00;TP R. Comptabilité 1;A302;FEDERICO BAHAMONTES;B1GEATP04;
2022-10-21 07:45:00;2022-10-21 09:15:00;PROJET Situer une organisation dans son environnement;Null;Null;B1GEATP06;
2022-09-14 10:30:00;2022-09-14 12:00:00;MAT R. Gestion opérationnelle des RH 1;B402;GUSTAVE GARRIGOU;B2GEMATD;
2023-01-30 09:15:00;2023-01-30 10:30:00;MAT Développement web : PHP\, HTML5\, JavaScript\, CSS\, XML;A201;JAKOB FUGLSANG;MMS;
2023-01-10 15:15:00;2023-01-10 16:45:00;MAT R. Outils numériques et de communication 2;A200;SAM BENNET;B2CJEATP02;
2023-01-26 08:15:00;2023-01-26 09:30:00;TD R. Management avancé des systèmes d’information;A301;GUSTAVE GARRIGOU;B2INFOTDD;
2022-10-24 12:45:00;2022-10-24 14:00:00;TP R. Programmation système;A304;ESTEBAN CHAVES;B2INFOTPA3, B2INFOTPD;
2022-09-19 08:15:00;2022-09-19 10:15:00;CM R. Culture graphique;C303;MICHAEL WOODS;B1ICCM;
2022-10-18 07:15:00;2022-10-18 08:15:00;CM R. Introduction à l'architecture des ordinateurs;B301 grande salle;SAM BENNET;B1INFOCM;
2022-11-17 10:15:00;2022-11-17 11:45:00;MAT Management situationnel;A400 Learning lab;JULIAN ALAPHILIPPE;CCRCFIIC;
2022-11-28 08:45:00;2022-11-28 10:15:00;TD R. Contrôle de gestion;B505;GREG LEMOND;B2GEMAALT;
2022-11-22 10:15:00;2022-11-22 11:45:00;TP R. Comptabilité 1;B505;GREG LEMOND;B1GEATP01;
2022-12-07 13:15:00;2022-12-07 14:30:00;TP R. Initiation au développement;A304;ANDY SCHLECK;B1INFOTP04;
2022-11-09 07:00:00;2022-11-09 09:00:00;MAT S. Exécution de gestion de stocks;A105;DYLAN TEUNS;B1QLIOTP01;
2022-11-30 09:30:00;2022-11-30 10:45:00;PROJET Recueil de besoins;B301 grande salle;Null;B1INFOTP02;
2022-11-07 16:00:00;2022-11-07 18:00:00;PROJET Contribution aux activités de pilotage et de conseil;Null;Null;B2CJEATP02;
2022-09-16 13:30:00;2022-09-16 15:00:00;TD R. Web;A202;MICHAEL MATTHEWS;B1ICTD;
2022-11-30 16:15:00;2022-11-30 17:45:00;PROJET Construire une posture professionnelle;Null;Null;B1GEATP01;
2022-11-17 08:45:00;2022-11-17 10:15:00;MAT Contrôle de gestion;B404;VALENTIN MADOUAS;DU;
2022-09-14 08:45:00;2022-09-14 10:15:00;CM R. Droit pénal;B302 grande salle;ALBERTO BETTIOL;B2CJEACM;
2022-11-21 08:45:00;2022-11-21 09:45:00;CM R. Introduction à la gestion des organisations;B301 grande salle;LEON SCIEUR;B1INFOCM;
2022-11-16 14:45:00;2022-11-16 16:15:00;MAT R. Méthodologie juridique : Niveau 1;B506;RUDY MOLARD;B1CJTD01;
2022-12-08 07:00:00;2022-12-08 08:30:00;TD R. Management d’activités : Management opérationnel;A204;NACER BOUHANNI;B2GEMATD;
2022-09-07 14:45:00;2022-09-07 16:00:00;TD R. Qualité de développement;B301 grande salle;GUILLAUME MARTIN;B2INFOTDA2, B2INFOTDD;
2022-12-03 09:00:00;2022-12-03 10:00:00;PROJET Formulation d'un conseil juridiques\, comptable\, finan;Null;Null;B1CJTP01;
2023-01-19 07:00:00;2023-01-19 11:00:00;MAT Analyse vibratoire;Null;KASPER ASGREEN;MIF;
2022-09-28 11:30:00;2022-09-28 13:00:00;TP R. Approvisionnements et exécution de planning;A102;ROBERT STANNARD;B1QLIOTP02;
2022-09-14 12:45:00;2022-09-14 14:00:00;TD R. Qualité de développement;A303;GUILLAUME MARTIN;B2INFOTDA1;
2023-01-04 12:00:00;2023-01-04 13:15:00;TP R. Initiation au développement;A201;ANDY SCHLECK;B1INFOTP04;
2022-10-21 12:15:00;2022-10-21 13:45:00;PROJET De la recherche de l’idée à la création d’activité à;Null;Null;B2GEMATP01;
2022-10-26 11:00:00;2022-10-26 14:00:00;TP R. Aide aux apprentissages 1;B402\,B404\,B505;HENRI PELISSIER, OCTAVE LAPIZE;B1GEATP05, B1GEATP06;
2022-11-23 12:30:00;2022-11-23 17:30:00;PROJET Développement d'une application;A205\,A305;Null;B2INFOTPA1, B2INFOTPA2, B2INFOTPA3, B2INFOTPD;
2022-11-28 12:30:00;2022-11-28 14:00:00;MAT Projet personnel et professionnel;B300 Learning lab;BERNARD HINAULT;MIF;
2023-01-25 08:45:00;2023-01-25 09:45:00;CM R. Introduction à la gestion des systèmes d’information;B302 grande salle;LEON SCIEUR;B1INFOCM;
2023-01-09 07:45:00;2023-01-09 09:30:00;CM R. Droit des sociétés;Null;ALBERTO BETTIOL;B2CJPFCM;
2022-11-09 08:15:00;2022-11-09 09:30:00;TP R. Qualité de développement;A205;GUILLAUME MARTIN;B2INFOTPA1;
2022-09-22 13:15:00;2022-09-22 15:15:00;MAT Algorithmique et programmation;A201;ANDY SCHLECK;MMS;
2022-10-19 13:45:00;2022-10-19 15:45:00;TD S. Portfolio 1;A203;LEON SCIEUR;B1CJTD01;
2023-01-11 12:30:00;2023-01-11 14:30:00;TP R. Outils\, méthodes et communication pour la qualité;A105;STEPHEN KUNG;B1QLIOTP01;
2022-12-03 16:00:00;2022-12-03 17:00:00;PROJET Formulation d'un conseil juridiques\, comptable\, finan;Null;Null;B1CJTP03;
2022-11-15 14:45:00;2022-11-15 16:00:00;TP R. Outils mathématiques fondamentaux;B301 grande salle;PETER SAGAN;B1INFOTP02;
2022-09-16 08:30:00;2022-09-16 09:45:00;TD R. Mathématiques discrètes;B301 grande salle;PETER SAGAN;B1INFOTD02;
2022-12-14 13:30:00;2022-12-14 14:30:00;PROJET Défendre un projet à l’aide d’un document de présenta;Null;Null;B1ICTP01;
2022-11-17 12:30:00;2022-11-17 13:30:00;PROJET Sécurisation des activités d’une organisation;Null;Null;B1CJTP04;
2022-09-15 08:45:00;2022-09-15 10:00:00;TP R. Initiation au développement;A300;ANDY SCHLECK;B1INFOTP01;
2022-12-02 08:45:00;2022-12-02 10:15:00;TD R. Environnement juridique 1;B402;ROGER PINGEON;B1GEATD02;
2022-11-07 14:00:00;2022-11-07 15:15:00;TP R. Outils numériques;A102;ALEJANDRO VALVERDE;B1QLIOTP02;
2022-11-30 07:00:00;2022-11-30 08:30:00;PROJET Contribuer au développement ou à la création d'entrep;Null;Null;B2GC2FTP02;
2022-09-24 09:00:00;2022-09-24 10:00:00;PROJET Rédaction professionnelle au sein d’une organisation;Null;Null;B1CJTP02;
2022-10-19 09:30:00;2022-10-19 10:30:00;CM R. Sciences de l'Information et de la Communication;C303;MICHAEL MATTHEWS;B1ICCM;
2022-10-21 08:30:00;2022-10-21 10:00:00;Rattrapage comptabilité A FIENO M CLAVEL;B505;Null;Null;
2022-11-18 12:30:00;2022-11-18 14:00:00;TP R. Démarches d’amélioration;A104;BINIAM GIRMAY;B2QLPALTP;
2022-09-29 12:00:00;2022-09-29 13:00:00;PROJET Rédaction professionnelle au sein d’une organisation;Null;Null;B1CJTP04;
2023-01-18 12:30:00;2023-01-18 14:00:00;oraux portfolio;B300 Learning lab;JULIAN ALAPHILIPPE;B1QLIOCM;
2022-10-17 11:30:00;2022-10-17 12:45:00;TD R. Mathématiques;A101;ALEJANDRO VALVERDE;B2QLPFITD;
2022-11-17 12:45:00;2022-11-17 14:15:00;MAT Webmarketing;A203;MIGUEL ANGEL LOPEZ;CCRCFI01;
2023-01-20 07:45:00;2023-01-20 09:15:00;TP R. Anglais appliqué aux domaines professionnels 2 : N4;A102;NICOLAS FRANTZ;B2CJPFTP02;
2022-12-07 07:00:00;2022-12-07 08:30:00;CM R. Environnement juridique 1;Amphithéâtre;RUDY MOLARD;B1GEACM;
2022-10-05 11:00:00;2022-10-05 13:00:00;MAT Sécurité et protection;Null;MARCO HALLER;MIF;
2022-11-07 17:00:00;2022-11-07 18:00:00;PROJET Fonctions et activités juridiques\, comptables\, financ;Null;Null;B1CJTP03;
2022-09-21 11:30:00;2022-09-21 12:30:00;CM R. Probabilités;B301 grande salle;PETER SAGAN;B2INFOCMA, B2INFOCMD;
2022-11-08 15:30:00;2022-11-08 16:45:00;TP R. Outils numériques;A307;ALEJANDRO VALVERDE;B1QLIOTP02;
2022-09-13 14:00:00;2022-09-13 15:00:00;CM R. Finance;Amphithéâtre;HENRI PELISSIER;B2GC2FCM, B2GEMACM;
2022-09-12 12:15:00;2022-09-12 13:30:00;TP R. Introduction aux bases de données et SQL;A205;DAVID GAUDU;B1INFOTP04;
2022-10-12 15:00:00;2022-10-12 16:15:00;TP R. Projet professionnel et personnel 1;A304;BERNARD HINAULT;B1INFOTP04;
2022-12-03 15:00:00;2022-12-03 16:00:00;PROJET Formulation d'un conseil juridiques\, comptable\, finan;Null;Null;B1CJTP01;
2022-11-28 14:45:00;2022-11-28 16:45:00;TP S. Fonctions et activités juridiques\, comptables\, financi;B401;GINO BARTALI;B1CJTP04;
2022-11-23 08:45:00;2022-11-23 10:15:00;TD R. Environnement juridique 1;B402;RUDY MOLARD;B1GEATD01;
2023-01-23 12:30:00;2023-01-23 13:45:00;TP R. Connaissance technologique de l’entreprise;A102;STEPHEN KUNG;B1QLIOTP02;
2022-12-14 12:30:00;2022-12-14 13:45:00;PROJET Développement d'une application;B301 grande salle;Null;B2INFOTPA1;
2022-10-14 11:30:00;2022-10-14 13:00:00;UE03 Politique d'investissement et de financem. (LFIN02)-TD;B403;HENRI PELISSIER;MLGAB3TD01;
2023-01-06 14:45:00;2023-01-06 16:00:00;PROJET Développement d'une application;A300;Null;B2INFOTPA1;
2022-12-13 09:00:00;2022-12-13 11:00:00;PROJET Concevoir un dispositif de communication hybridant;A400 Learning lab;Null;B2ICTP01;
2022-10-07 12:00:00;2022-10-07 13:30:00;TP R. Anglais appliqué aux affaires 1;B300 Learning lab;ROGER KLUGE;B1GEATP01;
2022-11-24 12:00:00;2022-11-24 13:15:00;PROJET Implémentation d’un besoin client;A205;Null;B1INFOTP02;
2022-10-07 06:00:00;2022-10-07 07:30:00;TD R. Environnement juridique 1;B402;ROGER PINGEON;B1GEATD02;
2022-12-16 10:30:00;2022-12-16 12:00:00;TP R. Outils mathématiques de gestion 1;B403;LUKE ROWE;B1GEATP02;
2022-10-24 14:15:00;2022-10-24 15:30:00;TP R. Programmation système;A304;ESTEBAN CHAVES;B2INFOTPA2;
2023-01-20 07:00:00;2023-01-20 08:00:00;CM R. Outils numériques pour les statistiques descriptives;B301 grande salle;PETER SAGAN;B1INFOCM;
2022-11-19 07:00:00;2022-11-19 08:30:00;PROJET Portfolio 1;Null;Null;B2CJEATP02;
2023-01-18 16:30:00;2023-01-18 18:00:00;trajet bus Cahors;Null;Null;MIF;
2023-01-06 07:00:00;2023-01-06 08:30:00;TD R. Outils et pilotage de l’organisation : Financement;C302 (salle en U);OCTAVE LAPIZE;B2GEMAALT;
2022-12-01 07:15:00;2022-12-01 08:15:00;PROJET Formulation d'un conseil juridiques\, comptable\, finan;Null;Null;B1CJTP01;
2022-12-16 14:15:00;2022-12-16 15:45:00;MAT R. Analyse financière;B401;GINO BARTALI;B2CJPFTD;
2023-01-03 15:00:00;2023-01-03 16:30:00;TP R. Anglais appliqué aux affaires 1;B300 Learning lab;ROGER KLUGE;B1GEATP06;
2022-10-06 06:00:00;2022-10-06 07:30:00;CM R. Environnement économique 1;Amphithéâtre;PIERRE ROLLAND;B1GEACM;
2022-12-06 14:45:00;2022-12-06 16:45:00;PROJET Portfolio 1;A204;BERNARD HINAULT;B2QLPALTP;
2022-09-22 11:30:00;2022-09-22 13:00:00;TD R. Organisations professionnelles;A200;JULIAN ALAPHILIPPE;B1ICTD;
2022-11-23 07:00:00;2022-11-23 08:15:00;PROJET Développement d'une application;A205;Null;B2INFOTPA2;
2023-01-05 09:15:00;2023-01-05 11:15:00;TP R. Management d’activités : Management opérationnel;A102;NACER BOUHANNI;B2GEMATP01;
2022-09-28 11:00:00;2022-09-28 15:00:00;MAT Sécurité et protection;Null;MARCO HALLER;MIF;
2023-02-03 07:00:00;2023-02-03 08:00:00;CM R. Outils numériques pour les statistiques descriptives;B301 grande salle;PETER SAGAN;B1INFOCM;
2022-12-14 10:30:00;2022-12-14 12:00:00;PROJET Situer une organisation dans son environnement;Null;Null;B1GEATP06;
2022-09-13 11:30:00;2022-09-13 13:00:00;MAT Stratégie de communication digitale;A202;ENRIC MAS;CCRCFI01;
2023-02-03 12:00:00;2023-02-03 14:00:00;TP R. Anglais appliqué aux domaines professionnels LV1 : N2;B501 Labo 1;PRIMOZ ROGLIC;B1CJTP02;
2023-01-25 16:30:00;2023-01-25 17:30:00;CM Qualité et au-delà du relationnel;B301 grande salle;GUILLAUME MARTIN;B2INFOCMA, B2INFOCMD;
2022-10-21 08:30:00;2022-10-21 10:30:00;MAT R. Structure et fonctionnement des organisations et RSE;B507;REIN TAARAMAE;B1CJTD02;
2023-01-11 07:00:00;2023-01-11 08:30:00;PROJET Contribuer au développement ou à la création d'une or;Null;Null;B2GEMATP01;
2023-01-23 08:00:00;2023-01-23 11:00:00;UE14 Gestion et financement de l’activité professionnelle;B504;GASTONE NENCINI;BANQUE;
2022-09-07 06:00:00;2022-09-07 07:15:00;TD R. Organisation d’un projet;A100;ARNAUD DEMARE;B1QLIOTD;
2022-09-29 06:00:00;2022-09-29 07:15:00;CM R. Coordination approvisionnements - production;A101;ROBERT STANNARD;B2QLPFICM;
2022-10-18 08:00:00;2022-10-18 09:30:00;TD R. Marketing / Webmarketing;C301;RUBEN FERNANDEZ;B2ICTD;
2022-09-19 11:30:00;2022-09-19 13:00:00;UE13 Analyse comptable et financière du client professionnel;B504;OCTAVE LAPIZE;BANQUE;
2022-09-23 12:15:00;2022-09-23 13:45:00;TP R. Expression/communication et culture générale 1;A200;THIBAUT PINOT;B2GEMATP02;
2023-01-30 09:45:00;2023-01-30 11:00:00;TP R. Exploitation d'une base de données;A205;DAVID GAUDU;B1INFOTP03;
2022-09-26 07:00:00;2022-09-26 08:30:00;MAT Droit social;B404;GUSTAVE GARRIGOU;DU;
2022-10-10 06:00:00;2022-10-10 07:15:00;PROJET Découverte de l'environnement économique et écologiqu;A201;Null;B1INFOTP03;
2023-01-03 10:30:00;2023-01-03 12:00:00;PROJET Contribuer au développement ou à la création d'une or;Null;Null;B2GEMATP02;
2022-10-27 11:30:00;2022-10-27 13:00:00;PROJET Situer une organisation dans son environnement;Null;Null;B1GEATP02;
2022-11-29 16:15:00;2022-11-29 17:45:00;PROJET Mettre en œuvre une organisation comptable et fiscale;Null;Null;B1GEATP03;
2022-11-07 15:00:00;2022-11-07 17:00:00;PROJET Concevoir et organiser un événement;Null;Null;B2ICTP02;
2022-10-31 09:00:00;2022-10-31 15:00:00;vacances Toussaint;Null;Null;B1QLIOCM;
2022-09-17 11:00:00;2022-09-17 13:00:00;PROJET Assistance à la prise de décision d’un client ou d'un;Null;Null;B2CJPFTP02;
2022-09-14 08:45:00;2022-09-14 10:00:00;TP R. Développement web;A304;JAKOB FUGLSANG;B2INFOTPA3, B2INFOTPD;
2022-09-17 11:00:00;2022-09-17 13:00:00;PROJET Assistance à la prise de décision relative à la préve;Null;Null;B2CJEATP02;
2023-01-31 10:30:00;2023-01-31 12:00:00;CM S. Participer\, dans le respect des contraintes règlementa;Amphithéâtre;MATTHIEU LADAGNOUS;B2GC2FCM, B2GEMACM;
2022-11-30 16:00:00;2022-11-30 17:15:00;TP R. Initiation au développement;A300;ANDY SCHLECK;B1INFOTP01;
2023-01-09 10:00:00;2023-01-09 12:00:00;TP R. Expression communication 2;B508;OSCAR PEREIRO;B2CJEATP01;
2022-12-14 09:00:00;2022-12-14 11:00:00;TP S. Concevoir un dispositif de communication hybridant;A400 Learning lab\,C200 Salle Infocom;MARK CAVENDISH;B2ICTP02;
2022-10-03 07:30:00;2022-10-03 08:30:00;CM R. Comptabilité 1;Amphithéâtre;FEDERICO BAHAMONTES;B1GEACM;
2022-11-09 16:00:00;2022-11-09 17:15:00;PROJET Installation d'un poste pour le développement;A500;Null;B1INFOTP03;
2022-10-28 12:45:00;2022-10-28 14:00:00;TD R. Anglais 1;B501 Labo 1;PHILIPPE THYS;B1INFOTD02;
2022-09-27 08:15:00;2022-09-27 10:15:00;CM R. Organisations professionnelles;A205;JULIAN ALAPHILIPPE;B1ICCM;
2022-12-16 08:30:00;2022-12-16 09:45:00;PROJET Projet Supply Chain en tant que technicien 1;A101;Null;B2QLPFITD;
2022-10-10 10:00:00;2022-10-10 11:00:00;CM R. Contrôle de gestion;Amphithéâtre;GREG LEMOND;B2GC2FCM, B2GEMACM;
2023-01-31 13:30:00;2023-01-31 14:45:00;TP R. Virtualisation;A303\,A500;ESTEBAN CHAVES;B2INFOTPA1;
2022-10-26 13:00:00;2022-10-26 15:00:00;MAT R. Droit des biens privés;B302 grande salle;ALBERTO BETTIOL;B2CJEACM;
2023-01-30 12:30:00;2023-01-30 13:45:00;TD R. Statistiques;A100;ALEJANDRO VALVERDE;B1QLIOTD;
2022-10-21 12:00:00;2022-10-21 13:30:00;PROJET Construire une posture professionnelle;Null;Null;B1GEATP01;
2023-01-10 12:00:00;2023-01-10 13:15:00;PROJET Comparaison d'approches algorithmiques;A303;Null;B1INFOTP02;
2022-10-12 08:15:00;2022-10-12 09:45:00;UE08 Outils d'aide à la décision (LMAT05) - TD;A200;MATTHIEU LADAGNOUS;MLGAB3TD01;
2022-10-14 06:45:00;2022-10-14 08:00:00;CM R. Anglais;B501 Labo 1;ROGER KLUGE;B1QLIOCM;
2022-11-17 12:30:00;2022-11-17 13:30:00;PROJET Sécurisation des activités d’une organisation;Null;Null;B1CJTP03;
2022-11-14 15:00:00;2022-11-14 16:15:00;PROJET Développement d'une application;A300;Null;B2INFOTPA3, B2INFOTPD;
2022-10-19 14:00:00;2022-10-19 15:30:00;MAT R. Gestion opérationnelle des RH 1;C302 (salle en U);GUSTAVE GARRIGOU;B2GEMAALT;
2022-10-01 12:45:00;2022-10-01 14:45:00;PROJET Assistance à la prise de décision relative à la préve;Null;Null;B2CJEATP01;
2022-11-26 08:00:00;2022-11-26 09:00:00;PROJET Sécurisation des activités d’une organisation;Null;Null;B1CJTP03;
2022-12-05 14:15:00;2022-12-05 15:45:00;TD R. Expression/Communication et culture générale 1;A200\,A102\,A204;THIBAUT PINOT;B1GEATD01;
2022-09-09 08:30:00;2022-09-09 10:15:00;TP R. Identification des flux physiques et d’information;A101;NACER BOUHANNI;B1QLIOTP01;
2022-10-05 07:45:00;2022-10-05 09:15:00;TD R. Management d’activités 1;B403;OCTAVE LAPIZE;B1GEATD03;
2022-10-05 09:30:00;2022-10-05 11:00:00;PROJET Situer une organisation dans son environnement;Null;Null;B1GEATP02;
2022-10-07 06:00:00;2022-10-07 07:30:00;TP R. Expression/Communication et culture générale 1;A203;OSCAR PEREIRO;B1GEATP05;
2022-12-08 12:30:00;2022-12-08 13:45:00;PROJET Développement d'une application;A303;Null;B2INFOTPA1;
2022-10-01 10:00:00;2022-10-01 11:00:00;PROJET Rédaction professionnelle au sein d’une organisation;Null;Null;B1CJTP01;
2022-11-09 17:00:00;2022-11-09 18:00:00;PROJET Fonctions et activités juridiques\, comptables\, financ;Null;Null;B1CJTP02;
2022-12-09 14:30:00;2022-12-09 16:00:00;TD S. Sécurisation des activités d’une organisation;B507;LUCIEN VAN IMPE;B1CJTD02;
2022-09-14 08:00:00;2022-09-14 10:00:00;CM R. Sciences de l’information et de la communication;C301;MICHAEL MATTHEWS;B2ICCM;
2022-12-06 08:45:00;2022-12-06 10:15:00;TD R. Comptabilité 1 : Techniques de base de comptabilité ap;B402;FEDERICO BAHAMONTES;B2GC2FTD;
2022-09-09 07:15:00;2022-09-09 08:30:00;TP R. Outils mathématiques fondamentaux;B301 grande salle;PETER SAGAN;B1INFOTP03;
2022-10-27 12:00:00;2022-10-27 13:30:00;PROJET Situer une organisation dans son environnement;Null;Null;B1GEATP04;
2023-01-27 14:15:00;2023-01-27 16:15:00;MAT R. Conduite de projet;B506;REIN TAARAMAE;B1CJTD02;
2022-09-29 07:15:00;2022-09-29 08:45:00;TD R. Anglais appliqué aux domaines professionnels 1 : N3;B401;PRIMOZ ROGLIC;B2CJEATD;
2022-11-28 12:30:00;2022-11-28 13:45:00;CM R. Gestion de l’entreprise;A101;LEON SCIEUR;B2QLPFICM;
2022-09-14 11:30:00;2022-09-14 12:30:00;CM R. Probabilités;B301 grande salle;PETER SAGAN;B2INFOCMA, B2INFOCMD;
2022-10-29 10:00:00;2022-10-29 11:00:00;PROJET Fonctions et activités juridiques\, comptables\, financ;Null;Null;B1CJTP02;
2022-09-21 06:30:00;2022-09-21 08:30:00;MAT Stratégie de communication globale (fondamentaux);C300;MATEJ MOHORIC;CCRCFIEG;
2022-12-16 10:00:00;2022-12-16 11:30:00;PROJET Déploiement des outils QLIO en tant que tech 1;A101;Null;B2QLPFITD;
2022-10-17 12:45:00;2022-10-17 14:15:00;PROJET Contribuer au développement ou à la création d'une or;Null;Null;B2GEMAALT;
2022-10-14 12:30:00;2022-10-14 14:00:00;TP R. Outils mathématiques de gestion 1;B402;HUGO KOBLET;B1GEATP04;
2022-10-17 12:15:00;2022-10-17 13:45:00;PROJET De la recherche de l’idée à la création d’activité à;Null;Null;B2GEMATP02;
2022-10-25 06:15:00;2022-10-25 07:15:00;CM R. Mathématiques discrètes;B301 grande salle;PETER SAGAN;B1INFOCM;
2022-10-05 14:00:00;2022-10-05 15:30:00;TD R. Environnement économique 1;B404;PIERRE ROLLAND;B1GEATD01;
